Completion %,Critic Rating,Format,My Rating,Date Finished,Hours Played,Release Date,Date Started,HLTB Complete,HLTB Extras,HLTB Story,Banner URL,Developer,Platform,Poster URL,Publisher,Review,Status,Summary,Title
0,87,0,0,,0.0,2019-04-30,,103.89361111111111,62.066944444444445,40.56527777777778,https://images.igdb.com/igdb/image/upload/t_screenshot_huge/vut5ddhxfdgv18vao4ek.png,Virtuos,Switch,https://images.igdb.com/igdb/image/upload/t_original/co2g6o.png,Square Enix,,Backlog,"""FINAL FANTASY XII THE ZODIAC AGE improves upon the 2006 classic FINAL FANTASY XII, now more beautiful and easier to play than ever. The high-definition remaster introduces several modern advancements, including reconstructed battle design and a revamped job system. With newly implemented trophies and share functions, as well as stark visual and sound improvements in true HD for the first time, players both returning and new to the game will experience a grand adventure that spans the world of Ivalice in an entirely fresh and improved way.

Includes several all-new enhanced gameplay features:
– The Zodiac Job System
– Improved character leveling system that now caters to the player’s preference
– Trial Mode – Take on monsters and enemies in up to 100 consecutive battles
– Speed Mode
– Latest-generation HD graphical capabilities, including characters and movie scenes fully remastered in high definition.
– True 7.1 surround sound, including high definition voicing and newly recorded background music utilizing the current generation of sound production.
– Modern advancements including PlayStation4 trophy support and share functionalities, auto-save and shortened loading times
– An endless amount of gameplay and adventure including Hunts, Battles, and mini-games""",Final Fantasy XII: The Zodiac Age
0,100,0,8,2021-09-24,0.0,2019-09-04,,17.323055555555555,16.843055555555555,14.946388888888889,https://images.igdb.com/igdb/image/upload/t_screenshot_huge/mmtbcuso2p10rrzr2xev.png,Nintendo EAD,Switch,https://images.igdb.com/igdb/image/upload/t_cover_big/co3pdo.png,St. GIGA,,Completed,"The Legend of Zelda: A Link to the Past is a top-down action game with puzzle-solving elements similar to the original The Legend of Zelda. After the side-scrolling and RPG-like gameplay of Zelda II: The Adventure of Link, the game is a return to the top-down view and gameplay style of the first installment. It introduces major new items to the series such as the Master Sword and the concept of two different worlds, which was revisited to some extent in Ocarina of Time with two distinct time periods rather than dark and light worlds.",The Legend of Zelda: A Link to the Past
0,84,0,0,,0.0,2019-04-11,,9.223055555555556,8.198333333333334,7.518888888888889,https://images.igdb.com/igdb/image/upload/t_screenshot_huge/rhfs0vbzhe7jvellemu4.png,Ninja Theory,Switch,https://images.igdb.com/igdb/image/upload/t_original/co2l7l.png,Ninja Theory,,Wishlist,"From the makers of Heavenly Sword, Enslaved: Odyssey to the West, and DmC: Devil May Cry, comes a warrior’s brutal journey into myth and madness.

Set in the Viking age, a broken Celtic warrior embarks on a haunting vision quest into Viking Hell to fight for the soul of her dead lover.

Created in collaboration with neuroscientists and people who experience psychosis, Hellblade: Senua’s Sacrifice will pull you deep into Senua’s mind.",Hellblade: Senua's Sacrifice
84,79,0,7,2021-09-24,4.733333333333333,2018-12-17,,5.147777777777778,4.658333333333333,4.061388888888889,https://images.igdb.com/igdb/image/upload/t_screenshot_huge/bwpqwqxuiwc164v2kt73.png,Campo Santo,Switch,https://images.igdb.com/igdb/image/upload/t_original/co1m35.png,Panic,,Completed,"Firewatch is a single-player first-person video game where you, as a man named Henry, explore the Wyoming wilderness after taking a summer job as a fire lookout. What is supposed to be a peaceful respite from your complicated life takes a turn when you start to question some of the things that are happening to you.

Your only human connection is over a handheld radio, which you’ll use to speak with your supervisor Delilah about the things both of you are experiencing.",Firewatch
100,97,2,10,2022-02-01,64.0,2017-03-03,2022-01-18,189.78416666666666,97.85527777777777,50.11138888888889,https://images.igdb.com/igdb/image/upload/t_screenshot_huge/vbs1btl6ts17zeos4g5v.png,Nintendo EPD Production Group No. 3,Switch,https://images.igdb.com/igdb/image/upload/t_original/co3p2d.png,Nintendo,,Completed,"The Legend of Zelda: Breath of the Wild is the first 3D open-world game in the Zelda series. Link can travel anywhere and be equipped with weapons and armor found throughout the world to grant him various bonuses. Unlike many games in the series, Breath of the Wild does not impose a specific order in which quests or dungeons must be completed. While the game still has environmental obstacles such as weather effects, inhospitable lands, or powerful enemies, many of them can be overcome using the right method. A lot of critics ranked Breath of the Wild as one of the best video games of all time.",The Legend of Zelda: Breath of the Wild
100,79,2,10,2021-08-23,5.516666666666667,2019-09-03,2021-07-25,79.74083333333333,53.6475,39.905277777777776,https://images.igdb.com/igdb/image/upload/t_screenshot_huge/sc6x4q.png,Square,Switch,https://images.igdb.com/igdb/image/upload/t_original/co2z8z.png,Square Enix,,Completed,"Final Fantasy VIII Remastered retains its original 4:3 aspect ratio in both FMVs and real-time graphic rendering, but enhance visuals with several characters, enemies, GF, and objects refined to look better. The music is unchanged from the original PlayStation version.",Final Fantasy VIII Remastered
0,0,0,0,,0.0,2023-08-29,,0.0,0.0,0.0,https://images.igdb.com/igdb/image/upload/t_original/scf2ra.png,Sabotage,Switch,https://images.igdb.com/igdb/image/upload/t_original/co215b.png,Sabotage,,Wishlist,"Sea of Stars is a turn-based RPG inspired by the classics. Promising the Sabotage touch in every system, Sea of Stars aims to modernize the classic RPG in terms of turn-based combat, storytelling, exploration and interactions with the environment, while still offering a hearty slice of nostalgia and good old, simple fun.",Sea of Stars
100,94,2,9,2023-04-09,21.416666666666668,2022-10-21,2023-02-25,142.9363888888889,123.30472222222222,101.40638888888888,https://images.igdb.com/igdb/image/upload/t_original/sc6vps.png,Atlus,Switch,https://images.igdb.com/igdb/image/upload/t_original/co1nic.png,Atlus USA,,Completed,An enhanced version of Persona 5 with some new characters and a third semester added to the game. Released Internationally in 2020.,Persona 5 Royal
0,82,0,0,,10.233333333333333,,,0.0,0.0,0.0,https://images.igdb.com/igdb/image/upload/t_original/xmzvjq9xfe99vnz0nihs.png,United Front Games,,https://images.igdb.com/igdb/image/upload/t_original/co2e3z.png,Bandai Namco Entertainment,,Backlog,"Wei Shen, an young officer working for the San Francisco Police Department gets tasked to go back to his hometown of Hong Kong. In Hong Kong Wei is assigned to the Hong Kong Police Department, in a effort to take down the ""Sun on Yee"" Wei goes undercover in the triad to gather information and take them down, But the police soon become worried that he is getting attached to his ""Friends"" such as Jackie Ma. In this journey of Betrayal and High stakes, Will Wei become a ""Red Pole"" and join the high ranks of the Triads or be discovered by them and buried alive?",Sleeping Dogs
1,0,0,0,,0.26666666666666666,,,0.0,0.0,0.0,https://images.igdb.com/igdb/image/upload/t_original/sc9j2n.png,Bugbear Entertainment,,https://images.igdb.com/igdb/image/upload/t_original/co2ysl.png,THQ Nordic,,Backlog,"Wreckfest is a demolition derby themed racing game with soft-body damage modeling, sophisticated driving dynamics and in-depth vehicle upgrading, featuring both demolition derbies and more traditional track races. It’s all about fun, breakneck racing and over-the-top crashes.",Wreckfest
4,50,0,0,,0.06666666666666667,,,0.0,0.0,0.0,https://images.igdb.com/igdb/image/upload/t_original/sc619w.png,We're Five Games,,https://images.igdb.com/igdb/image/upload/t_original/co1uwi.png,tinyBuild,,Backlog,"Delivery Attempted. That's the Totally Reliable Delivery Service guarantee! T.R.D.S. is a ragdoll physics simulation about terrible package delivery couriers. Work together using odd machinery, useful gadgets, and the wonders of physics to reliably deliver packages to their destination.",Totally Reliable Delivery Service
0,84,0,0,,8.816666666666666,2021-10-05,,40.3375,23.750833333333333,12.288055555555555,https://images.igdb.com/igdb/image/upload/t_original/vge00t2yg7abkq6uhhc1.png,Traveller's Tales,Switch,https://images.igdb.com/igdb/image/upload/t_original/co5bze.png,WB Games,,Backlog,"In LEGO Marvel Super Heroes, players will unlock more than 100 characters from across the Marvel Universe, including fan favorites like Spider-Man, Iron Man, Wolverine, Captain America, the Hulk, Thor, Black Widow, Hawkeye, Deadpool, Loki and Galactus! The game will pack in a plethora of super-cool character abilities, combat-like action sequences, epic battle scenes, puzzle-solving and a unique story told with playful LEGO humor.",LEGO Marvel Super Heroes
0,62,0,0,,0.11666666666666667,,,0.0,0.0,0.0,https://images.igdb.com/igdb/image/upload/t_original/duzggz8mg267ttxa7mmm.png,Ivory Tower,,https://images.igdb.com/igdb/image/upload/t_original/co54ib.png,Ubisoft Entertainment,,Backlog,"The newest iteration in the revolutionary franchise, The Crew 2 captures the thrill of the American motorsports spirit in one of the most exhilarating open worlds ever created. Welcome to Motornation, a huge, varied, action-packed, and beautiful playground built for motorsports throughout the entire US of A. Enjoy unrestrained exploration on ground, sea, and sky. From coast to coast, street and pro racers, off-road explorers, and freestylers gather and compete in all kinds of disciplines. Join them in high-octane contests and share every glorious moment with the world.",The Crew 2
0,77,0,0,,0.31666666666666665,,,0.0,0.0,0.0,https://images.igdb.com/igdb/image/upload/t_original/ii28sx5s46u1ttrhrsvf.png,Tarsier Studios,,https://images.igdb.com/igdb/image/upload/t_original/co1rdi.png,Bandai Namco Entertainment,,Backlog,"Immerse yourself in Little Nightmares, a dark whimsical tale that will confront you with your childhood fears! Help Six escape The Maw – a vast, mysterious vessel inhabited by corrupted souls looking for their next meal. As you progress on your journey, explore the most disturbing dollhouse offering a prison to escape from and a playground full of secrets to discover. Reconnect with your inner child to unleash your imagination and find the way out!",Little Nightmares
0,83,0,0,,0.5,2020-06-30,,122.92055555555555,98.45027777777777,61.30694444444445,https://images.igdb.com/igdb/image/upload/t_original/sc6str.png,Nihon Falcom,Switch,https://images.igdb.com/igdb/image/upload/t_original/co1mkb.png,Nihon Falcom,,Backlog,"The game is a direct sequel to the prior two Trails of Cold Steel games, picking up one and a half years after the events of Trails of Cold Steel II. The story will be centered around main character Rean Schwarzer, now a military professor, as well as his students, and the rest of his military school friends from the prior two entries, notably exploring subjects such as the mysterious origin's of Rean's birth, and what others have been up to since the events of the prior games. The game will also feature appearances from Tita and Agate, characters from Trails in the Sky, a separate meta series within The Legend of Heroes series, as well as Tio and Randy, characters from Trails to Zero.",The Legend of Heroes: Trails of Cold Steel III
0,73,0,0,,0.23333333333333334,,,0.0,0.0,0.0,https://images.igdb.com/igdb/image/upload/t_original/fzi1nrrphqfwwlwpko7u.png,Warhorse Studios,,https://images.igdb.com/igdb/image/upload/t_original/co4aqi.png,Deep Silver,,Backlog,"Story-driven open-world RPG that immerses you in an epic adventure in the Holy Roman Empire. Avenge your parents' death as you battle invading forces, go on game-changing quests, and make influential choices. Explore castles, forests, villages and other realistic settings in medieval Bohemia!",Kingdom Come: Deliverance
1,69,0,0,,0.5,,,0.0,0.0,0.0,https://images.igdb.com/igdb/image/upload/t_original/sc6w6h.png,Ghost Games,,https://images.igdb.com/igdb/image/upload/t_original/co209t.png,Electronic Arts,,Backlog,"Hustle by day and risk it all at night in Need for Speed Heat, a white-knuckle street racer, where the lines of the law fade as the sun starts to set. By day, Palm City hosts the Speedhunter Showdown, a sanctioned competition where you earn Bank to customize and upgrade your high-performance cars. At night, ramp up the intensity in illicit street races that build your reputation, getting you access to bigger races and better parts. But stay ready – cops are waiting and not all of them play fair",Need for Speed: Heat
8,0,0,0,,15.566666666666666,2019-03-26,,82.11333333333333,50.02861111111111,36.56777777777778,https://images.igdb.com/igdb/image/upload/t_original/schmyy.png,Square,Switch,https://images.igdb.com/igdb/image/upload/t_original/co4xgh.png,Square Enix,,Backlog,"In addition to graphical resolution improvements to the previous port, this re-release of the PC version of Final Fantasy VII also featured cloud saving, as well as unlockable achievements and a Character Booster feature. The consoles versions of Final Fantasy VII are based on the PC re-release, some little graphical improvements were made.",Final Fantasy VII
0,65,0,0,,1.9333333333333333,1999-11-30,,0.0,0.0,0.0,https://images.igdb.com/igdb/image/upload/t_original/tgtp8xme7tx5sguwn0y6.png,Traveller's Tales,PS1,https://images.igdb.com/igdb/image/upload/t_original/co3wv5.png,Activision,,Backlog,"Woody has been stolen from the bedroom, ready to be sold to the highest bidder by an evil toy collector. It's up to good friend Buzz Lightyear to fight his way through from the bedroom to the outside world in order to save Woody from the toy market and bring him home. All of the character from the 3D animated movie appear through-out the side scroller to help Buzz get to where he is needed. Along with the use of his cannon, Buzz can jump to hard to reach places, also useful in collecting the hidden coins that open bonus levels.",Toy Story 2: Buzz Lightyear to the Rescue!
3,93,0,0,,3.783333333333333,,,0.0,0.0,0.0,https://images.igdb.com/igdb/image/upload/t_original/scawfp.png,Sucker Punch Productions,,https://images.igdb.com/igdb/image/upload/t_original/co3p5f.png,Sony Interactive Entertainment,,Backlog,"Ghost of Tsushima: Director's Cut Includes:
- Full game.
- Iki Island expansion: New story, mini-games, enemy types and more.
- Legends online co-op mode.
- Digital mini art book by Dark Horse.
- Director’s commentary: The creative team sits down with a renowned Japanese historian to look at the world of Ghost of Tsushima and how it compares to the real-life events that inspired it.
- One Technique Point.
- Charm of Hachiman’s Favour.
- Hero of Tsushima Skin Set: Golden Mask, Sword Kit, Horse, Saddle.",Ghost of Tsushima: Director's Cut
0,75,0,0,,4.066666666666666,,,0.0,0.0,0.0,https://images.igdb.com/igdb/image/upload/t_original/ypmnvvx803gj1gyri0xz.png,Sega AM2,,https://images.igdb.com/igdb/image/upload/t_original/co2e3q.png,Sega,,Backlog,"""Originally released for the Dreamcast in 2000 and 2001, Shenmue I & II is an open world action adventure combining jujitsu combat, investigative sleuthing, RPG elements, and memorable mini-games. It pioneered many aspects of modern gaming, including open world city exploration, and was the game that coined the Quick Time Event (QTE). It was one of the first games with a persistent open world, where day cycles to night, weather changes, shops open and close and NPCs go about their business all on their own schedules. Its engrossing epic story and living world created a generation of passionate fans, and the game consistently makes the list of “greatest games of all time”.""",Shenmue I & II
0,66,0,0,,0.016666666666666666,,,0.0,0.0,0.0,https://images.igdb.com/igdb/image/upload/t_original/fijx8uf1lsmwi8tb4agn.png,VooFoo Studios,,https://images.igdb.com/igdb/image/upload/t_original/co24z4.png,VooFoo Studios,,Backlog,"The race is on in Mantis Burn Racing, where fast-paced bumper-to-bumper racing combines with intuitive, tactile gameplay and stunning visuals in one of the best-looking and most immersive top-down racers around. Drive incredible built-for-racing vehicles across highly detailed, visually stunning tracks, in high-risk, high-speed races where winning is everything. Prove your skills in an extensive career mode and take on friends with 4-player local split-screen racing and online modes for up to 8 players in ‘one-more-go’ style competitive racing. With a RPG-style upgrade system providing players with deep tactical choices and excellent replay-ability, this is racing at its rawest but most exciting!",Mantis Burn Racing
0,57,0,0,,0.016666666666666666,2014-10-03,,60.0,46.20916666666667,41.0,https://images.igdb.com/igdb/image/upload/t_original/sccf6g.png,Kadokawa Games,Vita,https://images.igdb.com/igdb/image/upload/t_original/co2qt6.png,Kadokawa Games,,Backlog,"Strategy role-playing gamers be ready, as this game will truly test your ability to conquer the evils that lurk in the sprawling networks of mines and ruins in the areas surrounding the fortress city of Feste. Seasoned explorers and novices alike venture underground into dangerous caves to collect the coveted material known as Pluton. During your first trip down into the depths of one of these mines, you and your new explorer friends quickly realize that things may be more dire than you had imagined as you encounter a brand-new type of evil lurking below the surface. You and your newfound friends must strategically defeat these new difficult foes and warn the kingdom of their presence before it's too late.",Natural Doctrine
0,0,0,0,,0.0,,,0.0,0.0,0.0,https://images.igdb.com/igdb/image/upload/t_original/sce5y9.png,,,https://images.igdb.com/igdb/image/upload/t_original/.png,,,Backlog,,Job Simulator
0,81,0,0,,8.883333333333333,,,0.0,0.0,0.0,https://images.igdb.com/igdb/image/upload/t_original/jonqwskjocnykh9s6gug.png,Bethesda Game Studios,,https://images.igdb.com/igdb/image/upload/t_original/co1vco.png,Bethesda Softworks,,Backlog,"Skyrim special edition is a remaster of the classic from 2011. Now with upgraded visuals.
Skyrim reimagines and revolutionises the open-world fantasy epic, bringing to life a complete virtual world open for you to explore any way you choose.",The Elder Scrolls V: Skyrim - Special Edition
0,84,0,0,,45.516666666666666,,,267.00805555555553,136.48638888888888,69.63416666666667,https://images.igdb.com/igdb/image/upload/t_original/sc8d2v.png,Mojang Studios,,https://images.igdb.com/igdb/image/upload/t_original/co49x5.png,Mojang Studios,,Backlog,"Minecraft focuses on allowing the player to explore, interact with, and modify a dynamically-generated map made of one-cubic-meter-sized blocks. In addition to blocks, the environment features plants, mobs, and items. Some activities in the game include mining for ore, fighting hostile mobs, and crafting new blocks and tools by gathering various resources found in the game. The game's open-ended model allows players to create structures, creations, and artwork on various multiplayer servers or their single-player maps. Other features include redstone circuits for logic computations and remote actions, minecarts and tracks, and a mysterious underworld called the Nether. A designated but completely optional goal of the game is to travel to a dimension called the End, and defeat the ender dragon.",Minecraft
0,83,0,0,,0.35,,,0.0,0.0,0.0,https://images.igdb.com/igdb/image/upload/t_original/sc6l7y.png,HoYoverse,,https://images.igdb.com/igdb/image/upload/t_original/co480t.png,HoYoverse,,Backlog,"Genshin Impact is an open-world action RPG, where you embark on a journey across Teyvat to find your lost sibling and seek answers from The Seven, the gods of each element. Explore this wondrous world, join forces with a diverse range of characters, and unravel the countless mysteries that Teyvat holds...",Genshin Impact
7,89,0,0,,5.15,,,0.0,0.0,0.0,https://images.igdb.com/igdb/image/upload/t_original/sc8dka.png,Codemasters,,https://images.igdb.com/igdb/image/upload/t_original/co2kts.png,Codemasters,,Backlog,"F1 2020 allows you to create your F1 team for the very first time and race alongside the official teams and drivers. Alternatively, challenge your friends in new split-screen with casual race options for more relaxed racing. Compete on 22 circuits, with current and classic content.",F1 2020
2,92,0,0,,39.083333333333336,,,0.0,0.0,0.0,https://images.igdb.com/igdb/image/upload/t_original/zco4xhfv2cidfddkotye.png,Media Molecule,,https://images.igdb.com/igdb/image/upload/t_original/co4rmx.png,Sony Interactive Entertainment,,Backlog,"Dreams is a game designed to unleash players’ creativity, turning the PS4 into the Creative console.

It’s both a playful sandbox game and an endless explorative journey where players can create and share their dreams, and then surf an endless dreamiverse of single assets, games, animation, music and everything in between. The thing that unites everything is the feeling of being in a dream.",Dreams
1,64,0,0,,1.5666666666666667,,,0.0,0.0,0.0,https://images.igdb.com/igdb/image/upload/t_original/sc6k7o.png,Other Ocean Interactive,,https://images.igdb.com/igdb/image/upload/t_original/co1tjg.png,Sony Interactive Entertainment,,Backlog,"Re-live the original adventure on PlayStation 4. The beloved fan-favorite has been completely remade from the grave up, blending classic gameplay with stunning visuals, all in eye-popping native 4K!",MediEvil
0,0,0,0,,0.45,,,0.0,0.0,0.0,https://images.igdb.com/igdb/image/upload/t_original/sc6l4d.png,Funsolve,,https://images.igdb.com/igdb/image/upload/t_original/co1s31.png,Outright Games,,Backlog,"Unite in adventure and laughter in the action-packed game of Jumanji, as you try to survive the ultimate challenge for those seeking to leave their world behind!

Only you and three teammates can recover the JEWELS and save Jumanji. So get online, gather friends for split-screen play, or go alone with AI companions. There’s an army of evil marauders to take on, deadly beasts and traps to dodge, and cool customizations to unlock. And with heroes Dr. Bravestone, Ruby, Mouse, and Prof. Oberon as your avatars, you know you’ve got the unique abilities – and hilarious failings – to save the day!",Jumanji: The Video Game
2,74,0,0,,17.45,,,0.0,0.0,0.0,https://images.igdb.com/igdb/image/upload/t_original/kjrtfpaex7mwrjazwv1m.png,SIE Bend Studio,,https://images.igdb.com/igdb/image/upload/t_original/co1izz.png,Sony Interactive Entertainment,,Backlog,"Days Gone is an open-world action-adventure game set in a harsh wilderness two years after a devastating global pandemic. Play as Deacon St. John, a Drifter and bounty hunter who rides the broken road, fighting to survive while searching for a reason to live.

At its core, Days Gone is about survivors and what makes them human: desperation, loss, madness, betrayal, friendship, brotherhood, regret, love – and hope. It’s about how even when confronted with such enormous tragedy they find a reason to live. Hope never dies.",Days Gone
0,74,0,0,,0.06666666666666667,2022-03-11,,124.32055555555556,91.90972222222223,51.321666666666665,https://images.igdb.com/igdb/image/upload/t_original/vxlmyvs1ubycvtn7dw0p.png,CyberConnect2,Switch,https://images.igdb.com/igdb/image/upload/t_original/co30zq.png,Bandai Namco Entertainment,,Backlog,"A remastered collection of the .hack//G.U. series with Improved graphics, systems, and game elements. This collection has an additional 4th volume continuing the story 16 months after the end of the 3rd game.
There is also a movie version of the story, called .hack//G.U. Termination Disc, that goes over the story of the first 4 .hack games and acts as a prequel to the .hack//G.U. trilogy ending just before the first game begins.
It will also include an optional cheat mode, that starts the player with maxed stats, for those who just want to experience the story.

"".hack//G.U. is back better than ever! Get ready to log back into .hack as the beloved cross media franchise returns with enhanced graphics, improved gameplay, and brand new modes! Join Haseo as he fights to discover what's reality in ""The World"" and save his friend Shino, who was put into a coma in the real world by the Player Killer Tri-Edge.

Celebrate the 15th anniversary of the franchise with the epic G.U trilogy, including the original .hack//G.U. titles - Rebirth, Reminisce, and Redemption - now with enhanced system features such as battle balance and game pacing!""",.Hack//G.U. Last Recode
4,72,0,0,,0.2833333333333333,,,0.0,0.0,0.0,https://images.igdb.com/igdb/image/upload/t_original/y8djofabxrwxbzuvgngm.png,No Brakes Games,,https://images.igdb.com/igdb/image/upload/t_original/co2y4a.png,Curve Digital,,Backlog,"Human: Fall Flat is an open-ended physics based puzzle game in which you take control of builder Bob helping him resolve the mysteries behind his recurring dreams of falling. Your goal is to escape those dreams full of puzzles, dangers and surprises using everything you find in the levels. The world of Bob dreams is built on his daily experiences, hopes, fears and memories interweaved in a net so sticky and hard to escape. All this mess is actually a carefully crafted work of… wait! You are the one to find it out! Bob is a human. Just a human. No hero. Zero superpowers. Period.",Human: Fall Flat
