Completion %,Critic Rating,Format,My Rating,Date Finished,Hours Played,Release Date,Date Started,HLTB Complete,HLTB Extras,HLTB Story,Banner URL,Developer,Platform,Poster URL,Publisher,Review,Status,Summary,Title
0,90,0,0,,0.0,2000-09-07,,11.536388888888888,8.52111111111111,8.02111111111111,https://images.igdb.com/igdb/image/upload/t_original/.png,Ubisoft Shanghai,PS1,https://images.igdb.com/igdb/image/upload/t_original/co6re0.png,,,Backlog,"The Sony PlayStation version removed and changes a bunch of levels, while merging others, and reduced the total amount of Yellow Lums from 1000 to 800. Some levels do however have several new areas and some cutscenes have been changed as well. This is the first version to have full voice acting. Many graphical changes are present, most notably in the Hall of Doors. A new bonus level can be unlocked which lets the player try a stage from the 2D prototype. Instead of Lums being imprisoned in cages, there are now Ludivs, Greenbottles and Minisaurus.",Rayman 2: The Great Escape
0,0,0,0,,0.0,2000-06-21,,72.13333333333334,32.48027777777778,23.89638888888889,https://images.igdb.com/igdb/image/upload/t_original/hkwsxaqh35hwm9xh7bmd.png,Square,PS1,https://images.igdb.com/igdb/image/upload/t_original/co2rso.png,Square Electronic Arts,,Backlog,"Adventure into a world of unparalleled depth and danger with SquareSoft's Vagrant Story. In this sweeping dungeon-crawling epic you play as Ashley Riot, a young assassin and spy for the organization known as Riskbreakers. Your goal is to unravel a deep and twisted plot and come to terms with the recent death of your wife and child. If this sounds a bit too cerebral never fear. Your path to recapturing your sense of humanity hinges on the destruction of countless vicious monsters and the exploration of dark and dangerous dungeons. Vagrant Story is awash in gorgeous scenery and features designs from Yasumi Matsuno and Akihiko Yoshida, the acclaimed artists and creators behind Final Fantasy Tactics.",Vagrant Story
0,80,0,0,,0.0,1997-04-30,,37.74111111111111,32.140277777777776,28.970277777777778,https://images.igdb.com/igdb/image/upload/t_original/sc95lw.png,Media.Vision,PS1,https://images.igdb.com/igdb/image/upload/t_original/co1war.png,Sony Computer Entertainment,,Backlog,"Wild Arms is a Western-themed role-playing video game developed by Japanese software company Media.Vision. Originally released in Japan in 1996 for the Sony PlayStation video game console, it was later translated and released in North America in 1997 and Europe in 1998 by Sony Computer Entertainment. It is noteworthy for not only being one of the first role-playing video games on the PlayStation, but also one of the few to feature a Western American setting and motif. The game features 2D computer graphics for normal gameplay, while battle sequences are rendered in 3D.",Wild Arms
0,0,0,0,,0.0,2000-04-30,,94.88333333333334,46.56944444444444,41.94444444444444,https://images.igdb.com/igdb/image/upload/t_original/.png,Media.Vision,PS1,https://images.igdb.com/igdb/image/upload/t_original/co66rn.png,Sony Computer Entertainment,,Backlog,"Wild Arms 2 is not a direct sequel to the first Wild Arms, although it is set in the same fictional world Filgaia, which combines elements of Old West, steampunk, and fantasy. The turn-based combat system against randomly appearing enemies resembles that of the predecessor, featuring techniques unique to each character, as well as the Guardian system, which allows the characters to summon powerful creatures to assist them in battles. Three combatants can be used actively in battles; the player can also switch any of them with a reserve character, up to six altogether.",Wild Arms 2
0,90,0,0,,0.0,1998-10-20,,80.24944444444445,65.49055555555556,56.33888888888889,https://images.igdb.com/igdb/image/upload/t_original/sc74tf.png,Square,PS1,https://images.igdb.com/igdb/image/upload/t_original/co2pp9.png,Square Electronic Arts,,Backlog,"Xenogears follows protagonist Fei Fong Wong and several others as they journey to uncover the truth behind mysterious, cabalistic entities operating in their world. The principles and philosophies of Friedrich Nietzsche, Sigmund Freud and Carl Jung influence the plot, character design, and world of Xenogears. Additionally, the symbols, theological concepts, and devotional practices of several world religions are represented in fictionalized forms in the game. Major psychological themes are the nature of identity and human memory, particularly as these relate to the phenomenon of dissociative identity disorder. The relationship between humanity and machines is central to the game's plot, as indicated by the presence of giant robots dubbed ""gears,"" which almost each playable character can control.",Xenogears
0,74,0,0,,0.0,2019-12-05,,0.0,0.0,0.0,https://images.igdb.com/igdb/image/upload/t_original/sc6z02.png,,Switch,https://images.igdb.com/igdb/image/upload/t_original/co1r59.png,Ubisoft Entertainment,,Backlog,"Get two action-packed games and all single-player DLC with Assassin’s Creed: The Rebel Collection.

Become the most feared pirate in the Caribbean in Assassin’s Creed IV Black Flag and transform into the ultimate assassin hunter in Assassin’s Creed Rogue.

Includes both Assassin’s Creed IV Black Flag, Assassin’s Creed Rogue, and all past DLC.
Become the most feared pirate in the Caribbean in Assassin’s Creed IV Black Flag. Take part in an award-winning naval experience and explore a massive open world.
Become the ultimate assassin hunter in Assassin’s Creed Rogue, and play as a Templar for the first time in franchise history.

Includes all single-player DLC, such as Freedom Cry, Guild of Rogues, the Illustrious Pirate Pack, the Crusader & Florentine Pack, and the Death Vessel Pack.
Experience enhanced features like Handheld Mode, HD Rumble, Touch Screen Interface, and Motion Control Aiming.",Assassin's Creed: The Rebel Collection
0,89,0,0,,2.0,2019-08-30,2023-08-15,80.69555555555556,28.15861111111111,20.546666666666667,https://images.igdb.com/igdb/image/upload/t_original/sc635h.png,PlatinumGames,Switch,https://images.igdb.com/igdb/image/upload/t_original/co1lzy.png,Nintendo,,Backlog,"ASTRAL CHAIN, a brand new action game from PlatinumGames, exclusive to Nintendo Switch! As part of a police special task force, it’s up to you to fight against mysterious, alien-like creatures who have invaded the world.",Astral Chain
0,82,0,0,,0.0,2021-01-28,,0.0,0.0,0.0,https://images.igdb.com/igdb/image/upload/t_original/sc8lpd.png,Koei Tecmo Games,Switch,https://images.igdb.com/igdb/image/upload/t_original/co2hbf.png,Koei Tecmo Games,,Backlog,"This story takes place three years after the events of the previous game “Atelier Ryza: Ever Darkness & the Secret Hideout,” and depicts the reunion of Ryza and her friends, who go through new encounters and goodbyes to discover a true priceless treasure.",Atelier Ryza 2: Lost Legends & the Secret Fairy
0,82,0,0,,0.0,2023-03-24,,0.0,0.0,0.0,https://images.igdb.com/igdb/image/upload/t_original/scix0m.png,Gust,Switch,https://images.igdb.com/igdb/image/upload/t_original/co59tz.png,Koei Tecmo Games,,Wishlist,"Ryza and her friends are living their lives on Kurken Island when news of a sudden appearance of a mysterious group of islands in nearby waters arrives. To find a way to save her island, Ryza and her friends will set off on final adventure surrounding the ""roots of alchemy.""",Atelier Ryza 3: Alchemist of the End & the Secret Key
0,77,0,0,,0.0,2018-05-15,,0.0,0.0,0.0,https://images.igdb.com/igdb/image/upload/t_original/c0nr3ah01r9cd9x8pgwn.png,Airship Syndicate,Switch,https://images.igdb.com/igdb/image/upload/t_original/zad8syobz3hdosfl9rar.png,THQ Nordic,,Backlog,"Battle Chasers: Nightwar is an American made JPRG and dungeon-crawler, based on the best-selling Battle Chasers comic series by Joe Maduriera and inspired by JPRG greats such as Final Fantasy, Suikoden, Chrono Trigger, and Phantasy Star. It was developed by Airship Syndicate, funded through Kickstarter and published by THQ Nordic. The game features beautiful environments; a gorgeously animated strategic turn-based combat system; and hand-crafted dungeon rooms which are randomly arranged for a different experience each time. Players will battle enemies, find secrets, solve puzzles and explore the world.",Battle Chasers: Nightwar
0,0,0,0,,0.0,2020-05-28,,0.0,0.0,0.0,https://images.igdb.com/igdb/image/upload/t_original/sc6eiu.png,Irrational Games,Switch,https://images.igdb.com/igdb/image/upload/t_original/co50k0.png,2K Games,,Backlog,"BioShock Infinite: The Complete Edition is a re-release of BioShock Infinite including all its downloadable content, exclusively for Xbox 360 and PlayStation 3 platforms.",BioShock Infinite: The Complete Edition
0,90,0,0,,0.0,2020-05-28,,0.0,0.0,0.0,https://images.igdb.com/igdb/image/upload/t_original/sc6qyj.png,Moonsprout Games,Switch,https://images.igdb.com/igdb/image/upload/t_original/co6r8x.png,DANGEN Entertainment,,Backlog,"Bug Fables: The Everlasting Sapling is an adventure RPG following three heroes, Vi, Kabbu, and Leif, as they embark on an epic quest in Bugaria in search of treasure and immortality. The game combines flat objects with 3D physics as the player jumps and utilizes the heroes’ unique abilities to solve puzzles and stun enemies while exploring a variety of unique, colorful areas. Battles are turn-based and with timed button inputs that can enhance your abilities.",Bug Fables: The Everlasting Sapling
0,81,0,0,,0.0,2019-05-16,,0.0,0.0,0.0,https://images.igdb.com/igdb/image/upload/t_original/scj8t8.png,Konami Digital Entertainment,Switch,https://images.igdb.com/igdb/image/upload/t_original/co24a1.png,Konami,,Backlog,"Konami's Castlevania Anniversary Collection traces the origins of the historic vampire franchise. Included is a unique eBook with details provided by developers, artists and others inspired by the Castlevania legacy which sheds a fresh light into the world of Castlevania.

Released as part of the Konami 50th Anniversary celebration, relive these timeless classics that helped define the platformer genre. From the Belmont clan to their extended bloodlines and allies, the Castlevania Anniversary Collection is the best first step for anyone to take into the world of Castlevania and the fight against Dracula!",Castlevania Anniversary Collection
0,0,0,0,,0.0,2021-10-07,,0.0,0.0,0.0,https://images.igdb.com/igdb/image/upload/t_original/sce6ap.png,Dead Mage,Switch,https://images.igdb.com/igdb/image/upload/t_original/co3z2d.png,11 bit studios,,Backlog,"Children of Morta is a narrative driven hack and slash roguelike. Take on the role of a member of the Bergson family, the Guardians of Mount Morta, as you fight desperately against the Corruption. Experience not only what it means to be a hero, but to be part of a family that bears the weight of the mountain together.

Children of Morta: Complete Edition includes:
- Children of Morta base game
- Family Trials
- New difficulty settings
- New Game+ Mode
- A new playable character: Apan
- New items packs
- Ancient Spirits DLC
- Paws & Claws - DLC
- Family Fireside Fables",Children of Morta: Complete Edition
0,80,0,0,,0.0,2022-04-07,,0.0,0.0,0.0,https://images.igdb.com/igdb/image/upload/t_original/scftop.png,Square Enix,Switch,https://images.igdb.com/igdb/image/upload/t_original/co4mw1.png,Square Enix,,Backlog,"Chrono Cross: The Radical Dreamers Edition is a remaster of Chrono Cross bundled with Radical Dreamers, which was previously only released for the Satellaview in Japan.",Chrono Cross: The Radical Dreamers Edition
0,77,0,0,,0.0,2018-08-14,,17.232222222222223,16.668055555555554,12.108888888888888,https://images.igdb.com/igdb/image/upload/t_original/hlqsod688fr5pcf0sgwz.png,Zeboyd Games,Switch,https://images.igdb.com/igdb/image/upload/t_original/co23mu.png,Limited Run Games,,Backlog,"""3 exotic planets to explore. Aliens. Robots. Magic. Forbidden technology. Ruined Worlds. Ghosts. Long-lost secrets. Conspiracies. A galactic threat. And one brave heroine to make things right. Cosmic Star Heroine is an exciting new RPG from the creators of Cthulhu Saves the World.""",Cosmic Star Heroine
0,81,0,0,,0.0,2020-10-07,,0.0,0.0,0.0,https://images.igdb.com/igdb/image/upload/t_original/gnzqnapjhpdv9bmdinfp.png,Radical Fish Games,Switch,https://images.igdb.com/igdb/image/upload/t_original/co28wy.png,Deck13 Interactive,,Backlog,"A retro-inspired 2D Action RPG set in the distant future. CrossCode combines 16-bit SNES-style graphics with butter-smooth physics, a fast-paced combat system, and engaging puzzle mechanics, served with a gripping sci-fi story.",CrossCode
0,0,0,0,,0.0,2019-10-24,,0.0,0.0,0.0,https://images.igdb.com/igdb/image/upload/t_original/sc66ku.png,JERA,Switch,https://images.igdb.com/igdb/image/upload/t_original/co1q1g.png,PQube,,Backlog,"This anime touch action game with stories base on Ximending. Players can carry on the phantom slaying adventures and fight along with guardians as story progresses. In game, you can experience the swiftness from the chain attacks and the fun of varies tactical skill combinations!",Dusk Diver
0,60,0,0,,0.0,2022-02-24,,32.8,29.185,13.702777777777778,https://images.igdb.com/igdb/image/upload/t_original/scdsu4.png,WANIN Games,Switch,https://images.igdb.com/igdb/image/upload/t_original/co3wrz.png,Justdan International,,Wishlist,Dragon Vein is a type of special energy that spans throughout all dimensions. Kunlun is the homeland of the higher dimensional beings who have developed advanced Dragon Vein technologies. The story begins with a girl named Yang Yumo and her classmate Liu Yusha when they accidentally trespassed Youshanding and started an adventure.,Dusk Diver 2
0,100,0,0,,0.0,2022-09-28,,0.0,0.0,0.0,https://images.igdb.com/igdb/image/upload/t_original/scj2dm.png,Bethesda Game Studios,Switch,https://images.igdb.com/igdb/image/upload/t_original/co3lyu.png,Bethesda Softworks,,Backlog,"The Elder Scrolls V: Skyrim - Anniversary Edition contains the full game plus all three expansions and over 500 pieces of unique content from Creation Club, including pre-existing and new quests, dungeons, bosses, weapons, spells and more!",The Elder Scrolls V: Skyrim - Anniversary Edition
0,67,0,0,,0.0,2018-09-13,,0.0,0.0,0.0,https://images.igdb.com/igdb/image/upload/t_original/wyujq0rzsemgm97deu9y.png,Square Enix,Switch,https://images.igdb.com/igdb/image/upload/t_original/co1vjc.png,Square Enix,,Backlog,"FINAL FANTASY XV in your pocket!

With a cute art style that will appeal to mobile and existing players alike and casual touch control optimized for mobile devices, allowing anyone to play with ease. The main story is told across ten thrilling episodes.",Final Fantasy XV: Pocket Edition
0,92,0,0,,0.0,2019-07-25,,0.0,0.0,0.0,https://images.igdb.com/igdb/image/upload/t_original/uzjlubc1tzcpvi1hx7ai.png,Intelligent Systems,Switch,https://images.igdb.com/igdb/image/upload/t_original/co1n8t.png,Nintendo,,Backlog,"Here, order is maintained by the Church of Seiros, which hosts the prestigious Officer’s Academy within its headquarters. You are invited to teach one of its three mighty houses, each comprised of students brimming with personality and represented by a royal from one of three territories. As their professor, you must lead your students in their academic lives and in turn-based, tactical RPG battles wrought with strategic, new twists to overcome. Which house, and which path, will you choose?",Fire Emblem: Three Houses
0,80,0,0,,0.0,2018-11-09,,0.0,0.0,0.0,https://images.igdb.com/igdb/image/upload/t_original/fbobjdtaxfdikpwryves.png,ThroughLine Games,Switch,https://images.igdb.com/igdb/image/upload/t_original/co1r68.png,Square Enix Collective,,Backlog,"Forgotton Anne is a 2d cinematic adventure game combining puzzle platforming with adventure game elements. You play as Anne, the enforcer keeping order in the Forgotton Realm, as she sets out to squash a rebellion that might prevent her master, Bonku, and herself from returning to the human world.

The World of Forgotton Anne: Imagine a place where everything that is lost and forgotten goes; old toys, letters, single socks. The Forgotten Realm is a magical world inhabited by Forgotlings, creatures composed of mislaid objects longing to be remembered again.",Forgotton Anne
0,76,0,0,,0.0,2018-09-25,,0.0,0.0,0.0,https://images.igdb.com/igdb/image/upload/t_original/nkjdboba0qmvkz1iv9ds.png,Black Forest Games,Switch,https://images.igdb.com/igdb/image/upload/t_original/co543z.png,HandyGames,,Backlog,"Giana Sisters: Twisted Dreams – Owltimate Edition offers classic 2D platforming fun in meticulously detailed 3D environments. Players can turn cute Giana into a punk version of herself at the press of a button, transforming the game’s star, the soundtrack and even the world.

This overhaul isn’t merely cosmetic: Giana’s punk persona is a critical to overcoming obstacles and solving particularly tricky situations. In her sweet incarnation, Giana whirls gracefully over obstacles and opponents, but when ‘punked up’ she smashes through stone blocks with mighty dashes and can master her environment by bouncing off walls.",Giana Sisters: Twisted Dreams - Owltimate Edition
0,88,0,0,,0.0,2019-08-15,,0.0,0.0,0.0,https://images.igdb.com/igdb/image/upload/t_original/sc6w9f.png,Game Arts,Switch,https://images.igdb.com/igdb/image/upload/t_original/co2w84.png,"GungHo Online Entertainment, Inc.",,Backlog,Two quintessential RPGs have finally gone portable on one of gaming's most popular console/handheld hybrid platforms. The highly anticipated GRANDIA HD Collection for the Nintendo Switch is here.,Grandia HD Collection
0,78,0,0,,0.0,2019-09-18,,0.0,0.0,0.0,https://images.igdb.com/igdb/image/upload/t_original/jktta1q6fk8nljf9b3vf.png,Codemasters Southam,Switch,https://images.igdb.com/igdb/image/upload/t_original/co2803.png,Codemasters,,Backlog,"It’s all about the teams, the rivals and the race as you become a driver for hire, specialising in your favourite disciplines or conquering them all in an intense world of professional motorsport. GRID Autosport features over 100 routes across 22 incredible locations, the return of in-car view, authentic handling and the world’s most exciting contemporary and classic high-performance racing cars.﻿",Grid: Autosport
0,36,0,0,,0.7666666666666667,2018-07-27,,0.0,0.0,0.0,https://images.igdb.com/igdb/image/upload/t_original/y9s7qv25untipfcirlei.png,DYNAMIC PIXELS,Switch,https://images.igdb.com/igdb/image/upload/t_original/co1r7c.png,tinyBuild,,Backlog,Hello Neighbor is a stealth horror game about sneaking into Mr.Petersons house to figure out what horrible secrets he's hiding in the basement. You play against an advanced AI that learns from your every move. Really enjoying climbing through that backyard window? Expect a bear trap there. Sneaking through the front door? There'll be cameras there soon. Trying to escape? The Neighbor will find a shortcut and catch you.,Hello Neighbor
0,85,0,0,,0.0,2018-11-28,,0.0,0.0,0.0,https://images.igdb.com/igdb/image/upload/t_original/csdem4pexwwmr8r7vdg7.png,Aquiris Game Studio,Switch,https://images.igdb.com/igdb/image/upload/t_original/co27ow.png,Aquiris Game Studio,,Backlog,"Horizon Chase Turbo is a standalone homage to classic 16-bit racers that defined a generation of high-speed, frenetic arcade fun. The game ignites an instant blast of nostalgia with catchy contemporary chiptune music, split screen multiplayer and retro design with modern gameplay.",Horizon Chase Turbo
0,68,0,0,,0.0,2021-09-30,,0.0,0.0,0.0,https://images.igdb.com/igdb/image/upload/t_original/sc93c7.png,Milestone,Switch,https://images.igdb.com/igdb/image/upload/t_original/co2u4x.png,Milestone,,Backlog,"Collect the best vehicles in the Hot Wheels universe, build spectacular tracks and dive into breathtaking races. The most iconic and sought after Hot Wheels vehicles are waiting for you. Get ready to make them race at full speed!",Hot Wheels Unleashed
0,80,0,0,,0.0,2020-04-28,,0.0,0.0,0.0,https://images.igdb.com/igdb/image/upload/t_original/loeuidxbc0bdsqf9qhyb.png,Lab Zero Games,Switch,https://images.igdb.com/igdb/image/upload/t_original/co4n93.png,505 Games,,Backlog,"Indivisible is a side-scrolling RPG in the vein of Valkyrie Profile, spanning a huge fantasy world inspired by our own world’s various cultures and mythologies.

Players will navigate beautiful environments using a variety of different traversal abilities, and engage monsters in fast-paced combat.",Indivisible
0,80,0,0,,0.0,2020-08-25,,0.0,0.0,0.0,https://images.igdb.com/igdb/image/upload/t_original/rxohgczyinikf4rn13t0.png,Mografi,Switch,https://images.igdb.com/igdb/image/upload/t_original/co1qq3.png,Mografi,,Backlog,"Jenny LeClue is a story focused exploration adventure game with memorable characters, a unique aesthetic, and an epic tangled mystery.

Jenny is a brilliant young detective, but nothing exciting happens in her small town of Arthurton, and she longs for real adventure. She gets more than she bargains for, when her mother is accused of murder. Jenny takes on the case of a lifetime and begins an unexpected, dangerous journey to uncover the truth. It’s also a coming-of-age meta-narrative about the blurred lines between right and wrong.",Jenny LeClue: Detectivu
0,77,0,0,,0.0,2017-04-07,,0.0,0.0,0.0,https://images.igdb.com/igdb/image/upload/t_original/a1ssubjbxjfrn02on9ns.png,TT Fusion,Switch,https://images.igdb.com/igdb/image/upload/t_original/co5vx0.png,Nintendo,,Backlog,"As Chase McCain, you'll become an expert at hand-to-hand combat, fighting your foes and wrestling them to the ground until you can slap the cuffs on 'em. The best officers are also pros at free running, jumping, climbing, and traversing the city on special blue and white bricks. Do you have what it takes?",LEGO City Undercover
0,65,0,0,,0.0,2019-01-24,,0.0,0.0,0.0,https://images.igdb.com/igdb/image/upload/t_original/l9lreyuabk8yyd9m13sn.png,SemiSoft,Switch,https://images.igdb.com/igdb/image/upload/t_original/co2y4i.png,Another Indie,,Backlog,"LEGRAND LEGACY is a spiritual successor to some all-time favorite JRPGs with a fresh take on the classic turn-based combat. Explore a beautifully hand-drawn world riddled with fantastical creatures, devastating wars, and intriguing stories of personal redemption. Play our demo and discover why Legrand Legacy is the ""Most Promising Game"" of the year!",Legrand Legacy
0,92,0,0,,0.0,2017-04-28,,0.0,0.0,0.0,https://images.igdb.com/igdb/image/upload/t_original/xdzg7620kqx6i4zkm4tp.png,Nintendo EPD,Switch,https://images.igdb.com/igdb/image/upload/t_original/co213p.png,Nintendo,,Backlog,"Hit the road with the definitive version of Mario Kart 8 and play anytime, anywhere! Race your friends or battle them in a revised battle mode on new and returning battle courses. Play locally in up to 4-player multiplayer in 1080p while playing in TV Mode. Every track from the Wii U version, including DLC, makes a glorious return. Plus, the Inklings appear as all-new guest characters, along with returning favorites, such as King Boo, Dry Bones, and Bowser Jr.!",Mario Kart 8 Deluxe
0,89,0,0,,0.0,2018-06-21,,267.00805555555553,136.48638888888888,69.63416666666667,https://images.igdb.com/igdb/image/upload/t_original/sc8d2k.png,,Switch,https://images.igdb.com/igdb/image/upload/t_original/co2b4k.png,,,Backlog,"Minecraft focuses on allowing the player to explore, interact with, and modify a dynamically-generated map made of one-cubic-meter-sized blocks. In addition to blocks, the environment features plants, mobs, and items. Some activities in the game include mining for ore, fighting hostile mobs, and crafting new blocks and tools by gathering various resources found in the game. The game's open-ended model allows players to create structures, creations, and artwork on various multiplayer servers or their single-player maps. Other features include redstone circuits for logic computations and remote actions, minecarts and tracks, and a mysterious underworld called the Nether. A designated but completely optional goal of the game is to travel to a dimension called the End, and defeat the ender dragon.",Minecraft
0,81,0,0,,0.0,2018-11-05,,0.0,0.0,0.0,https://images.igdb.com/igdb/image/upload/t_original/c4oqtpe5c7oqr2zspn8e.png,Digital Sun Games,Switch,https://images.igdb.com/igdb/image/upload/t_original/co1vck.png,11 bit studios,,Backlog,"Moonlighter is an Action RPG with rogue-lite elements that demonstrates two sides of the coin – revealing everyday routines of Will, an adventurous shopkeeper that secretly dreams of becoming a hero.",Moonlighter
0,82,0,0,,0.0,2019-01-11,,0.0,0.0,0.0,https://images.igdb.com/igdb/image/upload/t_original/dnubasrryx51b80koamd.png,Nintendo EPD,Switch,https://images.igdb.com/igdb/image/upload/t_original/co1uhl.png,Nintendo,,Backlog,New Super Mario Bros. U including New Super Luigi U. for the Nintendo Switch!,New Super Mario Bros. U Deluxe
