Completion %,Critic Rating,Format,My Rating,Date Finished,Hours Played,Release Date,Date Started,HLTB Complete,HLTB Extras,HLTB Story,Banner URL,Developer,Platform,Poster URL,Publisher,Review,Status,Summary,Title
0,87,0,0,,0.0,2019-04-30,,103.89361111111111,62.066944444444445,40.56527777777778,https://images.igdb.com/igdb/image/upload/t_screenshot_huge/vut5ddhxfdgv18vao4ek.png,Virtuos,Switch,https://images.igdb.com/igdb/image/upload/t_original/co2g6o.png,Square Enix,,C Play Later,"""FINAL FANTASY XII THE ZODIAC AGE improves upon the 2006 classic FINAL FANTASY XII, now more beautiful and easier to play than ever. The high-definition remaster introduces several modern advancements, including reconstructed battle design and a revamped job system. With newly implemented trophies and share functions, as well as stark visual and sound improvements in true HD for the first time, players both returning and new to the game will experience a grand adventure that spans the world of Ivalice in an entirely fresh and improved way.

Includes several all-new enhanced gameplay features:
– The Zodiac Job System
– Improved character leveling system that now caters to the player’s preference
– Trial Mode – Take on monsters and enemies in up to 100 consecutive battles
– Speed Mode
– Latest-generation HD graphical capabilities, including characters and movie scenes fully remastered in high definition.
– True 7.1 surround sound, including high definition voicing and newly recorded background music utilizing the current generation of sound production.
– Modern advancements including PlayStation4 trophy support and share functionalities, auto-save and shortened loading times
– An endless amount of gameplay and adventure including Hunts, Battles, and mini-games""",Final Fantasy XII: The Zodiac Age
0,100,0,8,2021-09-24,0.0,2019-09-04,,17.308055555555555,16.840833333333332,14.945555555555556,https://images.igdb.com/igdb/image/upload/t_screenshot_huge/mmtbcuso2p10rrzr2xev.png,Nintendo EAD,Switch,https://images.igdb.com/igdb/image/upload/t_cover_big/co3pdo.png,St. GIGA,,Finished,"The Legend of Zelda: A Link to the Past is a top-down action game with puzzle-solving elements similar to the original The Legend of Zelda. After the side-scrolling and RPG-like gameplay of Zelda II: The Adventure of Link, the game is a return to the top-down view and gameplay style of the first installment. It introduces major new items to the series such as the Master Sword and the concept of two different worlds, which was revisited to some extent in Ocarina of Time with two distinct time periods rather than dark and light worlds.",The Legend of Zelda: A Link to the Past
0,84,0,0,,0.0,2019-04-11,,9.223055555555556,8.198333333333334,7.518888888888889,https://images.igdb.com/igdb/image/upload/t_screenshot_huge/rhfs0vbzhe7jvellemu4.png,Ninja Theory,Switch,https://images.igdb.com/igdb/image/upload/t_original/co2l7l.png,Ninja Theory,,Wanted,"From the makers of Heavenly Sword, Enslaved: Odyssey to the West, and DmC: Devil May Cry, comes a warrior’s brutal journey into myth and madness.

Set in the Viking age, a broken Celtic warrior embarks on a haunting vision quest into Viking Hell to fight for the soul of her dead lover.

Created in collaboration with neuroscientists and people who experience psychosis, Hellblade: Senua’s Sacrifice will pull you deep into Senua’s mind.",Hellblade: Senua's Sacrifice
84,79,0,6,2021-09-24,4.733333333333333,2018-12-17,,5.152777777777778,4.656666666666666,4.0625,https://images.igdb.com/igdb/image/upload/t_screenshot_huge/bwpqwqxuiwc164v2kt73.png,Campo Santo,Switch,https://images.igdb.com/igdb/image/upload/t_original/co1m35.png,Panic,,Finished,"Firewatch is a single-player first-person video game where you, as a man named Henry, explore the Wyoming wilderness after taking a summer job as a fire lookout. What is supposed to be a peaceful respite from your complicated life takes a turn when you start to question some of the things that are happening to you.

Your only human connection is over a handheld radio, which you’ll use to speak with your supervisor Delilah about the things both of you are experiencing.",Firewatch
100,97,2,10,2022-02-01,64.0,2017-03-03,2022-01-18,189.78305555555556,97.81444444444445,50.11611111111111,https://images.igdb.com/igdb/image/upload/t_screenshot_huge/vbs1btl6ts17zeos4g5v.png,Nintendo EPD Production Group No. 3,Switch,https://images.igdb.com/igdb/image/upload/t_original/co3p2d.png,Nintendo,,Completed,"The Legend of Zelda: Breath of the Wild is the first 3D open-world game in the Zelda series. Link can travel anywhere and be equipped with weapons and armor found throughout the world to grant him various bonuses. Unlike many games in the series, Breath of the Wild does not impose a specific order in which quests or dungeons must be completed. While the game still has environmental obstacles such as weather effects, inhospitable lands, or powerful enemies, many of them can be overcome using the right method. A lot of critics ranked Breath of the Wild as one of the best video games of all time.",The Legend of Zelda: Breath of the Wild
100,79,2,10,2021-08-23,5.516666666666667,2019-09-03,2021-07-25,79.75611111111111,53.631388888888885,39.89083333333333,https://images.igdb.com/igdb/image/upload/t_screenshot_huge/sc6x4q.png,Square,Switch,https://images.igdb.com/igdb/image/upload/t_original/co2z8z.png,Square Enix,,Completed,"Final Fantasy VIII Remastered retains its original 4:3 aspect ratio in both FMVs and real-time graphic rendering, but enhance visuals with several characters, enemies, GF, and objects refined to look better. The music is unchanged from the original PlayStation version.",Final Fantasy VIII Remastered
0,0,0,0,,0.0,2023-08-29,,0.0,0.0,0.0,https://images.igdb.com/igdb/image/upload/t_original/scf2ra.png,Sabotage,Switch,https://images.igdb.com/igdb/image/upload/t_original/co215b.png,Sabotage,,Wanted,"Sea of Stars is a turn-based RPG inspired by the classics. Promising the Sabotage touch in every system, Sea of Stars aims to modernize the classic RPG in terms of turn-based combat, storytelling, exploration and interactions with the environment, while still offering a hearty slice of nostalgia and good old, simple fun.",Sea of Stars
100,94,2,10,2023-04-09,21.416666666666668,2022-10-21,2023-02-25,143.1338888888889,123.18305555555555,101.48861111111111,https://images.igdb.com/igdb/image/upload/t_original/sc6vps.png,Atlus,Switch,https://images.igdb.com/igdb/image/upload/t_original/co1nic.png,Atlus USA,,Completed,An enhanced version of Persona 5 with some new characters and a third semester added to the game. Released Internationally in 2020.,Persona 5 Royal
0,80,0,0,,0.2833333333333333,2013-11-15,,0.0,0.0,0.0,https://images.igdb.com/igdb/image/upload/t_original/yq7owbqrj09mgfqg3ac3.png,EA Digital Illusions CE,PS4,https://images.igdb.com/igdb/image/upload/t_original/co1nmf.png,Electronic Arts,,Collection,"Battlefield 4 is the genre-defining action blockbuster created by Dice, and made from moments that blur the line between game and glory, moments found only in Battlefield. Go to Boot Camp to learn the basics of Battlefield 4's engaging single player and intense multiplayer mode. Here you'll also find intel on Levolution, Commander Mode, Naval Warfare and many more exciting game features.",Battlefield 4
48,80,0,0,,26.166666666666668,2016-03-22,,0.0,0.0,0.0,https://images.igdb.com/igdb/image/upload/t_original/rbzr6uzmstcmopfjsisl.png,Nadeo,PS4,https://images.igdb.com/igdb/image/upload/t_original/co1z4h.png,,,Collection,"Trackmania offers you the ultimate arcade racing universe where everything is about reaching the perfect racing time. Test your skills in over 200 tracks, experience immediate fun by challenging your friends at home (offline splitscreen) or online. The competition lasts forever: design and share your own tracks with other players in the Trackbuilder!",TrackMania Turbo
4,63,0,0,,0.06666666666666667,2017-05-30,,0.0,0.0,0.0,https://images.igdb.com/igdb/image/upload/t_original/lpbnzcsu1lg512q6mqet.png,Three Fields Entertainment,PS4,https://images.igdb.com/igdb/image/upload/t_original/co23q3.png,Three Fields Entertainment,,Collection,"Danger Zone is an all new 3D vehicular destruction game, a genre we know well. The concept is simple : crash for cash by creating the biggest car crash.  
  
The Danger Zone is a virtual Crash Testing Facility where players step into the shoes of a dangerous driver and are challenged to survive a variety of spectacular crash testing scenarios.  
  
It’s easy to crash, but can you also grab all of the Bonus Pickups?  
  
Powered by Unreal Engine, Danger Zone combines real physical crashes with explosive gameplay. Shunt vehicles into oncoming traffic, take down trailers to shed their payloads and use your explosive “SmashBreaker” to move your vehicle around. The more explosions you cause, the bigger your score.  
  
If you’re feeling burnt out by congestion and jammed roads, take the highway to the Danger Zone. Take your revenge on rush hour traffic. This place is a paradise for those who like their driving flame-grilled.",Danger Zone
0,79,0,0,,0.0,2015-01-30,,0.0,0.0,0.0,https://images.igdb.com/igdb/image/upload/t_original/t7o715q23arxkeurs799.png,DON'T NOD,PS4,https://images.igdb.com/igdb/image/upload/t_original/co3h8p.png,Square Enix,,Collection,"Max Caulfield, student at Blackwell Academy in Arcadia Bay, Oregon, discovers she can rewind time. The episode revolves around her testing her power and reuniting with her old best friend. The pair set out to find out more about the disappearance of Rachel Amber, the harassment of Kate Marsh and the drug schemes of Nathan Prescott.",Life is Strange: Episode 1 - Chrysalis
0,73,0,0,,0.03333333333333333,2013-11-15,,0.0,0.0,0.0,https://images.igdb.com/igdb/image/upload/t_original/tmylb5knvikgpetzh9s1.png,Digital Extremes,PS4,https://images.igdb.com/igdb/image/upload/t_original/co1nhi.png,Digital Extremes,,Collection,"Warframe situates players as members of the Tenno race, newly awoken after years of cryo-sleep into a solar system at war. Reborn into a corrupt era, the Tenno are sought by the oppressive Grineer Empire for annihilation. Warframe armor is the key to overthrowing the Grineer by providing players with unique offensive and defensive powers to explore, upgrade and master during purpose-driven radical raids.",Warframe
5,84,0,0,,10.766666666666667,2016-04-12,,0.0,0.0,0.0,https://images.igdb.com/igdb/image/upload/t_original/vedxjruyzyajs2viwl6z.png,Insomniac Games,PS4,https://images.igdb.com/igdb/image/upload/t_original/co230k.png,Sony Interactive Entertainment,,Collection,"Ratchet & Clank is a new game based on elements from the original Ratchet & Clank (PS2), featuring more than an hour of new cinematics (including footage from the film) in vibrant 1080p, new locations, weapons, bosses and more. Join Ratchet, Clank, Captain Qwark and new friends as they embark on an intergalactic adventure, and experience the start of an epic friendship (again) on PlayStation 4.",Ratchet & Clank
4,80,0,0,,5.733333333333333,2019-05-14,,0.0,0.0,0.0,https://images.igdb.com/igdb/image/upload/t_original/yl6vcx14pyvwfdf3epew.png,Asobo Studio,PS4,https://images.igdb.com/igdb/image/upload/t_original/co1lat.png,Focus Entertainment,,Collection,"A Plague Tale: Innocence, on PlayStation 4, Xbox One and PC, tells the grim story of two siblings fighting together for survival in the darkest hours of History. This new video game from Asobo Studio sends you on an emotional journey through the 14th century France, with gameplay combining adventure, action and stealth, supported by a compelling story. Follow the young Amicia and her little brother Hugo, who face the brutality of a ravaged world as they discover their purpose to expose a dark secret. On the run from the Inquisition's soldiers, surrounded by unstoppable swarms of rats incarnating the Black Death, Amicia and Hugo will learn to know and trust each other as they struggle for their lives against all odds.",A Plague Tale: Innocence
0,66,0,0,,0.15,2018-01-23,,0.0,0.0,0.0,https://images.igdb.com/igdb/image/upload/t_original/rd4vug8n2nzt2rvtproc.png,Tokyo RPG Factory,PS4,https://images.igdb.com/igdb/image/upload/t_original/co1pwu.png,Square Enix,,Collection,"""The next evolution in this new golden age of JRPG’s arrives with LOST SPHEAR, bringing a fresh take on classic RPG gameplay! A young man, who suffered a phenomenon that he had never seen, faces an ominous power that threatens the fabric of reality. Awaken the power of Memory to restore what was lost! Muster different Memory and craft the world around you in a journey to save the world.""",Lost Sphear
0,83,0,0,,1.05,2015-08-12,,0.0,0.0,0.0,https://images.igdb.com/igdb/image/upload/t_original/k5ymzkjthfmttvdluxwv.png,Starbreeze Studios,PS4,https://images.igdb.com/igdb/image/upload/t_original/co1rro.png,505 Games,,Collection,"Brothers is presented from a third-person view overlooking the two brothers. The brothers are moved individually by two thumbsticks on the controller. The controller triggers also cause the respective brother to interact with the game world, such as talking to a non-player character or grabbing onto a ledge or object.

The older brother is the stronger of the two and can pull levers or boost his younger brother to higher spaces, while the younger one can pass between narrow bars. The player progresses by manipulating the two brothers at the same time to complete various puzzles, often requiring the player to manipulate both brothers to perform differing functions (such as one distracting a hostile non-player character while the other makes their way around).

Should either brother fall from a great height or get injured, the game restarts at a recent checkpoint. All of the in-game dialogue is spoken in a fictional language, thus the story is conveyed through actions, gestures and expressions.",Brothers: A Tale of Two Sons
0,82,0,0,,10.233333333333333,,,0.0,0.0,0.0,https://images.igdb.com/igdb/image/upload/t_original/xmzvjq9xfe99vnz0nihs.png,United Front Games,,https://images.igdb.com/igdb/image/upload/t_original/co2e3z.png,Bandai Namco Entertainment,,Collection,"Wei Shen, an young officer working for the San Francisco Police Department gets tasked to go back to his hometown of Hong Kong. In Hong Kong Wei is assigned to the Hong Kong Police Department, in a effort to take down the ""Sun on Yee"" Wei goes undercover in the triad to gather information and take them down, But the police soon become worried that he is getting attached to his ""Friends"" such as Jackie Ma. In this journey of Betrayal and High stakes, Will Wei become a ""Red Pole"" and join the high ranks of the Triads or be discovered by them and buried alive?",Sleeping Dogs
1,0,0,0,,0.26666666666666666,,,0.0,0.0,0.0,https://images.igdb.com/igdb/image/upload/t_original/sc9j2n.png,Bugbear Entertainment,,https://images.igdb.com/igdb/image/upload/t_original/co2ysl.png,THQ Nordic,,Collection,"Wreckfest is a demolition derby themed racing game with soft-body damage modeling, sophisticated driving dynamics and in-depth vehicle upgrading, featuring both demolition derbies and more traditional track races. It’s all about fun, breakneck racing and over-the-top crashes.",Wreckfest
1,67,0,0,,0.1,2014-08-12,,0.0,0.0,0.0,https://images.igdb.com/igdb/image/upload/t_original/kefsvlnzkj4f52qtmaxm.png,Bossa Studios,PS4,https://images.igdb.com/igdb/image/upload/t_original/co4o2m.png,Bossa Studios,,Collection,"The most critically acclaimed, one-handed, clumsy, bumbling, surgery simulation game has now arrived on PS4! Players use their controllers to operate one of Doctor Nigel Burke’s flailing arms, in an attempt to perform life-saving surgery on his peaceful and trusting patient, Bob. Includes the exclusive PS4 multiplayer offline co-op mode. Two controllers, two hands... still one poor Bob!",Surgeon Simulator: Anniversary Edition
4,50,0,0,,0.06666666666666667,,,0.0,0.0,0.0,https://images.igdb.com/igdb/image/upload/t_original/sc619w.png,We're Five Games,,https://images.igdb.com/igdb/image/upload/t_original/co1uwi.png,tinyBuild,,Collection,"Delivery Attempted. That's the Totally Reliable Delivery Service guarantee! T.R.D.S. is a ragdoll physics simulation about terrible package delivery couriers. Work together using odd machinery, useful gadgets, and the wonders of physics to reliably deliver packages to their destination.",Totally Reliable Delivery Service
7,63,0,0,,0.6,2015-08-18,,0.0,0.0,0.0,https://images.igdb.com/igdb/image/upload/t_original/mayykrzxzw35ec5ph5eg.png,Straight Right,PS4,https://images.igdb.com/igdb/image/upload/t_original/co22as.png,,,Collection,"London is falling. Are you prepared? The Last Blight is upon us. It was foretold. For the second time in history, a great plague has shrouded London in a fog of death. Big Ben tolls as thousands of unprepared die, or worse, are infected by a sickness more gruesome than death.

""The nail-biting survival experience of ZombiU has been upgraded for download on next-gen consoles and PC. Zombi takes the power of the latest generation of hardware to bring you a new level of horror. Test your will to survive, but beware: death is permanent, and one wrong move can cause you to lose everything.""",Zombi
0,72,0,0,,1.1166666666666667,2015-04-14,,0.0,0.0,0.0,https://images.igdb.com/igdb/image/upload/t_original/uzkwriq0oplnh7hie6rj.png,Acid Nerve,PS4,https://images.igdb.com/igdb/image/upload/t_original/co2xo0.png,Devolver Digital,,Collection,"Between our world and the world beyond lie the Titan Souls, the spiritual source and sum of all living things. Now scattered amongst the ruins and guarded by the idle titans charged with their care, a solitary hero armed with but a single arrow is once again assembling shards of the Titan Soul in a quest for truth and power.",Titan Souls
0,72,0,0,,17.683333333333334,2010-07-15,,16.185555555555556,7.149444444444445,4.608888888888889,https://images.igdb.com/igdb/image/upload/t_original/vkhez6oznwv2monfvfg9.png,Avalanche Software,X360,https://images.igdb.com/igdb/image/upload/t_original/co2rqb.png,Disney Interactive Studios,,C Play Later,"In Toy Story 3: The Video Game help Buzz, Woody and the rest of the Toys ensure no toy gets left behind. Dive into all new heroic adventures in Story Mode or let your imagination run wild in the exiting new open world of Toy Box Mode! Come and play to infinity... and beyond!",Toy Story 3: The Video Game
0,84,0,0,,8.816666666666666,2021-10-05,,40.3375,23.750833333333333,12.288055555555555,https://images.igdb.com/igdb/image/upload/t_original/vge00t2yg7abkq6uhhc1.png,Traveller's Tales,Switch,https://images.igdb.com/igdb/image/upload/t_original/co5bze.png,WB Games,,C Play Later,"In LEGO Marvel Super Heroes, players will unlock more than 100 characters from across the Marvel Universe, including fan favorites like Spider-Man, Iron Man, Wolverine, Captain America, the Hulk, Thor, Black Widow, Hawkeye, Deadpool, Loki and Galactus! The game will pack in a plethora of super-cool character abilities, combat-like action sequences, epic battle scenes, puzzle-solving and a unique story told with playful LEGO humor.",LEGO Marvel Super Heroes
4,79,0,0,,1.7333333333333334,2015-09-01,,0.0,0.0,0.0,https://images.igdb.com/igdb/image/upload/t_original/tee1mscx9i0e4dbxpjbr.png,Renegade Kid,PS4,https://images.igdb.com/igdb/image/upload/t_original/co2aby.png,Good Shepherd Entertainment,,Collection,"Xeodrifter is an action-packed exploration game with a retro graphical style. Blast your way through alien landscapes, seek out valuable secrets, and defeat ancient guardians to unlock powers from a legendary supreme culture in this exciting journey of mystery and adventure.",Xeodrifter
0,69,0,0,,0.1,2014-06-09,,0.0,0.0,0.0,https://images.igdb.com/igdb/image/upload/t_original/lcbsgwkbxttlc286hick.png,Pixelopus,PS4,https://images.igdb.com/igdb/image/upload/t_original/co2q20.png,Sony Computer Entertainment,,Collection,"Entwined is a beautiful game about a bird and a fish that are in love but can’t be together. Learn to guide these two souls simultaneously then unite and transform them into a magnificent Dragon.

Over the course of nine unique lifetimes can you become Entwined forever?",Entwined
0,84,0,0,,2.966666666666667,2015-12-02,,0.0,0.0,0.0,https://images.igdb.com/igdb/image/upload/t_original/sc99xz.png,Playdead,PS4,https://images.igdb.com/igdb/image/upload/t_original/co1qrs.png,Microsoft Game Studios,,Collection,Limbo is a black and white puzzle-platforming adventure. Play the role of a young boy traveling through an eerie and treacherous world in an attempt to discover the fate of his sister.,Limbo
1,70,0,0,,3.75,2019-10-18,,0.0,0.0,0.0,https://images.igdb.com/igdb/image/upload/t_original/sc77mj.png,PopCap Games,PS4,https://images.igdb.com/igdb/image/upload/t_original/co3isd.png,Electronic Arts,,Collection,"Similar to its predecessors, the game is a third-person shooter where players take control of the Plants or the Zombies in either a cooperative or competitive multiplayer environment. The game features 20 customizable gameplay classes, six of which are new to the franchise, and they are classified into three groups: attackers, defenders, or support. Each camp also has a new team play class that allows players of the same class to combine forms when they fight against enemies. Players can compete against each other in various competitive multiplayer modes, including the objective-based Turf War mode and the team deathmatch variant Team Vanquish. The game also features several player-versus-environment open zones which allowed players to explore, find collectibles, and complete quests. Split-screen local multiplayer is also available for all gameplay mode",Plants vs. Zombies: Battle for Neighborville
0,40,0,0,,0.0,2016-06-21,,0.0,0.0,0.0,https://images.igdb.com/igdb/image/upload/t_original/b6ldgklmhbzqujw2fbnn.png,,PS4,https://images.igdb.com/igdb/image/upload/t_original/co2diq.png,Milestone,,Collection,"MXGP2 - The Official Motocross Videogame Compact will let you relive the Motocross World Championship, allowing you to choose all the riders, official teams and tracks from the 2015 MXGP-class season!",MXGP2: The Official Motocross Videogame
0,81,0,0,,0.5333333333333333,2014-03-19,,0.0,0.0,0.0,https://images.igdb.com/igdb/image/upload/t_original/qcdthxyya3hf5m1walf5.png,Image & Form,PS4,https://images.igdb.com/igdb/image/upload/t_original/v1jtxva0er1d25ui0o8p.png,,,Collection,"SteamWorld Dig is 2D a platform game that revolves around mining for resources and ores. The objective of the game is to investigate the mines underneath the old Western town Tumbleton in order to unearth the secrets lurking below. The player controls Rusty who is equipped with a pickaxe but the player is given options to upgrade the tools used for digging as progression is made in the game. Besides health, the player also needs coal for light, and water for special abilities.
SteamWorld Dig has platform elements in that the player runs, jumps and encounter foes, but the main objective is mining. That means that the player builds – or rather deconstructs – the game world and creates platforms that way. The player collects resources and other hidden resources which can be brought back to the surface and exchanged for cash. When the player progress in the game new abilities are unlocked. Each playthrough, the mines are randomized, making items and treasure appear in different locations. If the player gets stuck there is a self destruct function, but the players can also buy ladders in the store at the surface to get out of tricky situations.
When progressing deeper down in the cave, the player encounters various enemies with different attack patterns and weak spots. The game features multiple worlds, each with a completely different environment. Dying results in a reparation penalty fee, and the player respawns back on the surface. All the loot that has been accumulated when the player dies can be picked up again.",SteamWorld Dig
0,79,0,0,,1.1166666666666667,2014-12-03,,0.0,0.0,0.0,https://images.igdb.com/igdb/image/upload/t_original/qxrjrm2ablpasrvfsdwj.png,Rain Games,PS4,https://images.igdb.com/igdb/image/upload/t_original/co2iqf.png,Snow Cannon Games,,Collection,"Teslagrad is a 2D puzzle platformer with action elements, where magnetism and other electromagnetic powers are the key to go throughout the game, and thereby discover the secrets kept in the long abandoned Tesla Tower. Gain new abilities to explore a non-linear world with more than 100 beautiful hand-drawn environments, in a steampunk-inspired vision of old Europe. Jump into an outstanding adventure told through voiceless storytelling, writing your own part. Armed with ancient Teslamancer technology and your own ingenuity and creativity, your path lies through the decrepit Tesla Tower and beyond.",Teslagrad
0,23,0,0,,0.38333333333333336,2016-11-08,,0.0,0.0,0.0,https://images.igdb.com/igdb/image/upload/t_original/jjrnirs33uncqdgnrpni.png,Magic Pockets,PS4,https://images.igdb.com/igdb/image/upload/t_original/co22v8.png,GameMill Entertainment,,Collection,"""When Uncle Grandpa accidentally drives the UG-RV through multiple dimensions, he picks up some surprise passengers in the form of Gumball, Steven Universe, Finn, Mordecai and Clarence! Now they'll have to band together to defeat the evil shard creatures and set things right. Use each character's unique attacks and special moves to conquer the elements, fight your way through all the levels and beat some brutal boss battles. Replay maps with special modifiers to switch up the fun, and unlock bonus rooms along the way. Take on the single-player challenge in this crazy interdimensional adventure.""

(3DS Version does not have multiplayer)",Cartoon Network: Battle Crashers
