Completion %,Critic Rating,Format,My Rating,Date Finished,Hours Played,Release Date,Date Started,HLTB Complete,HLTB Extras,HLTB Story,Banner URL,Developer,Platform,Poster URL,Publisher,Review,Status,Summary,Title
22,78,0,0,,320.5,2014-09-09,,0.0,0.0,0.0,https://images.igdb.com/igdb/image/upload/t_original/fva4jrbuuw2ejijtsoj8.png,Bungie,PS4,https://images.igdb.com/igdb/image/upload/t_original/co1rco.png,Activision,,Collection,"Bungie has emphasized that the universe of Destiny will be ""alive"". Events may happen in-game that are not necessarily controlled or planned by the developer, which will help to create a dynamic developing experience for Bungie and a dynamic playing experience for gamers. The game's style has been described a first-person shooter that will incorporate massively multiplayer online game (MMO) elements, but Bungie has avoided defining Destiny as a traditional MMO game. Instead, the game has been referred to as a ""shared-world shooter,"" as it lacks many of the characteristics of a traditional MMO game. For instance, rather than players being able to see and interact with all other players in the game or on a particular server—as is the case in many conventional MMO games—Destiny will include on-the-fly matchmaking that will allow players to see and interact only with other players with whom they are ""matched"" by the game.
Destiny will incorporate a new game engine that allows global illuminations and real-time dynamic lighting to occur together. An innovation in Bungie's ""hopper"" technology, which has been the backbone for Halo's matchmaking system, will allow better player matchmaking in order to create a more natural experience in either cooperative or competitive multiplayer modes.",Destiny
0,70,0,0,,0.08333333333333333,2014-02-16,,0.0,0.0,0.0,https://images.igdb.com/igdb/image/upload/t_original/boaarnylspkk7e8h5b7a.png,SideQuest Studios,PS4,https://images.igdb.com/igdb/image/upload/t_original/xc2cyw3fulmuns2npcmx.png,EastAsiaSoft,,Collection,"Embark on an epic adventure that leads you through a beautiful, isometric, open world with detailed high-definition visuals. Rainbow Moon is a strategy RPG with a strong emphasis on exploration, character development and turn-based battles. Six playable main characters with upgradeable weapons, armor and accessories; about 100 special skills and more than 20 challenging dungeons are awaiting you in a fascinating story that lasts over 40 hours.

Rainbow Moon is a game by gamers, dedicated to gamers.",Rainbow Moon
0,73,0,0,,2.183333333333333,2016-08-10,,0.0,0.0,0.0,https://images.igdb.com/igdb/image/upload/t_original/slbfwlrvqjrgvrvfghrk.png,Hello Games,PS4,https://images.igdb.com/igdb/image/upload/t_original/co5j66.png,505 Games,,Collection,"Inspired by the adventure and imagination that we love from classic science-fiction, No Man's Sky presents you with a galaxy to explore, filled with unique planets and lifeforms, and constant danger and action.

In No Man's Sky, every star is the light of a distant sun, each orbited by planets filled with life, and you can go to any of them you choose. Fly smoothly from deep space to planetary surfaces, with no loading screens, and no limits. In this infinite procedurally generated universe, you'll discover places and creatures that no other players have seen before - and perhaps never will again.",No Man's Sky
55,89,0,0,,90.8,2020-04-10,,0.0,0.0,0.0,https://images.igdb.com/igdb/image/upload/t_original/sc6viw.png,Square Enix,PS4,https://images.igdb.com/igdb/image/upload/t_original/co1qxr.png,Square Enix,,Collection,"A spectacular re-imagining of one of the most visionary games ever, Final Fantasy VII Remake rebuilds and expands the legendary RPG for today. The first game in this project is set in the eclectic city of Midgar and presents a fully standalone gaming experience.",Final Fantasy VII Remake
10,60,0,0,,14.733333333333333,2013-11-15,,0.0,0.0,0.0,https://images.igdb.com/igdb/image/upload/t_original/dodospi1ugx7yqjvuwko.png,SCE Japan Studio,PS4,https://images.igdb.com/igdb/image/upload/t_original/co4lea.png,Sony Computer Entertainment,,Collection,"From Mark Cerny, one of the greatest minds in video games today, Knack is a fun-filled adventure of colossal proportions that invites players to wield fantastic powers and discover a unique and vibrant world.",Knack
0,85,0,0,,0.1,2016-04-19,,0.0,0.0,0.0,https://images.igdb.com/igdb/image/upload/t_original/txgagz4xaugcyq82hkdt.png,Klei Entertainment,PS4,https://images.igdb.com/igdb/image/upload/t_original/co2efb.png,Klei Entertainment,,Collection,"""Take control of Invisible's agents in the field and infiltrate the world's most dangerous corporations. Stealth, precision, and teamwork are essential in high-stakes, high-profit missions, where every move may cost an agent their life.""","Invisible, Inc."
0,75,0,0,,0.03333333333333333,2016-10-28,,83.62138888888889,47.18972222222222,35.41166666666667,https://images.igdb.com/igdb/image/upload/t_original/cd0lwgtz93hybtwoaykq.png,Square Enix,Vita,https://images.igdb.com/igdb/image/upload/t_original/co24k0.png,Square Enix,,C Play Later,"World of Final Fantasy combines classic RPG gameplay mechanics with fresh and imaginative toy-like visuals. As a brand-new title in the Final Fantasy franchise, this game can be enjoyed by both fans and newcomers to the series. Players will lead a pair of twins through varied Final Fantasy worlds and encounter the adorably familiar monsters therein. Capture and raise such familiar beasts as cactuar, chocobo, and behemoth to discover alternate forms and learn new abilities.",World of Final Fantasy
0,0,0,0,,0.016666666666666666,2015-09-01,,0.0,0.0,0.0,https://images.igdb.com/igdb/image/upload/t_original/y0dfccqdhvht31d5l5sb.png,Capybara Games,PS4,https://images.igdb.com/igdb/image/upload/t_original/co2e2p.png,Capybara Games,,Collection,"Super Time Force Ultra is an action-packed platformer with a time-travelling twist! You’re in control of time itself, bending and stretching it to your advantage on the battlefield. Rewind time and choose when to jump back into the action, teaming-up with your past selves in a unique single-player co-op experience! Take control of up to 16 unique characters, and battle across 6 different time periods, from the long-ago past to the far-away future.",Super Time Force Ultra
35,85,0,0,,10.733333333333333,,,0.0,0.0,0.0,https://images.igdb.com/igdb/image/upload/t_original/sc8bii.png,BlueTwelve Studio,,https://images.igdb.com/igdb/image/upload/t_original/co4tt2.png,Annapurna Interactive,,Collection,"Lost, alone, and separated from family, a stray cat must untangle an ancient mystery to escape a long-forgotten cybercity and find the way home.",Stray
1,92,0,0,,0.5666666666666667,2020-09-10,,0.0,0.0,0.0,https://images.igdb.com/igdb/image/upload/t_original/sc8qxw.png,Remedy Entertainment,PS4,https://images.igdb.com/igdb/image/upload/t_original/co2ewb.png,505 Games,,Collection,"Control Ultimate Edition contains the main game and all previously released Expansions (""The Foundation"" and ""AWE"") in one great value package. Winner of over 80 awards, Control is a visually stunning third-person action-adventure that will keep you on the edge of your seat.",Control: Ultimate Edition
0,77,0,0,,31.466666666666665,2017-10-18,,0.0,0.0,0.0,https://images.igdb.com/igdb/image/upload/t_original/hvmdcxdkwcmvymhyiky7.png,Polyphony Digital,PS4,https://images.igdb.com/igdb/image/upload/t_original/co3wk2.png,Sony Interactive Entertainment,,Collection,"Welcome to the future of motorsports – the definitive motor racing experience is back and better than ever only on PlayStation 4.

Gran Turismo Sport is the world’s first racing experience to be built from the ground up to bring global, online competitions sanctioned by the highest governing body of international motorsports, the FIA (Federation International Automobile). Create your legacy as you represent and compete for your home country or favorite manufacturer.",Gran Turismo Sport
0,33,0,0,,0.1,2017-10-31,,0.0,0.0,0.0,https://images.igdb.com/igdb/image/upload/t_original/nokko0z5srfx5fiyrntv.png,Black Forest Games,PS4,https://images.igdb.com/igdb/image/upload/t_original/fgwgl5gc00cg5syybti6.png,Tommo Inc,,Collection,"""Bubsy the Woolies Strike Back! is an all new Bubsy adventure featuring Bubsy in a bevy of exotic locations as he travels the planet looking for the beloved Golden Fleece.

Bubsy must use all of his classic moves and a few new ones to dodge and out bobcat a battalion of Woolies, not mention the gnarliest UFO bosses to ever grace a Bubsy adventure.

The wisecracking lynx also adds over a 100 new one liners to his lexicon to keep fans guessing what he’ll say next.""",Bubsy: The Woolies Strike Back
0,80,0,0,,0.36666666666666664,2019-02-26,,0.0,0.0,0.0,https://images.igdb.com/igdb/image/upload/t_original/sc5iqf.png,Codemasters,PS4,https://images.igdb.com/igdb/image/upload/t_original/co1sro.png,Codemasters,,Collection,"Dirt Rally 2.0 dares you to carve your way through a selection of iconic rally locations from across the globe, in the most powerful off-road vehicles ever made, knowing that the smallest mistake could end your stage.",Dirt Rally 2.0
0,70,0,0,,0.5333333333333333,2016-05-17,,0.0,0.0,0.0,https://images.igdb.com/igdb/image/upload/t_original/sccg7i.png,Media.Vision,PS4,https://images.igdb.com/igdb/image/upload/t_original/co2wi4.png,Sony Computer Entertainment,,Collection,"The first two games in the Wild Arms series garnered attention and acclaim as they brought classic console role-playing to the original PlayStation. Though crafted in the same story-telling spirit, Wild Arms 3 (titled Wild Arms Advanced 3rd in Japan) boasts major technological improvements and a number of new gameplay elements. Featuring ""stroke-shaded"" animation-style graphics, a ""Wild West"" setting, and a completely 3D game engine (not just for battles, as in the previous games), Wild Arms 3 is designed to make good use of the power of the PlayStation 2.

Wild Arms 3 features four main characters and takes the time to let players become acquainted with each of them. The ""drifters"" Virginia, Gallows, Jet, and Clive are four very different adventurers whose paths intertwine toward a shared destiny. Though each has his or her own personal motivations, all four seek an explanation for why the once-verdant lands of Filgaia have become dry and barren. Differences must be overcome and the characters must act in harmony if they are to truly understand the ancient mystical forces at work.

As the drifters move through the desolate land of Filgaia, they are challenged with a number of mysteries to solve and barriers to overcome. The different special abilities of each character must be used to solve different parts of the game's complex puzzles. A technique dubbed ""expressive communication"" is designed to allow players to quickly gauge the moods and emotions of the onscreen characters. Monsters, villains, and other horrible creatures stand between the drifters and their destinations as well. The Wild Arms 3 turn-based battle system is designed to offer players an intricate level of control, allowing tactics that make wise use of the various powers and weaponry of the drifters while presenting combat with cinematic flair.

Wild Arms 3 delivers everything RPG gamers expect: an in-depth storyline, puzzling dungeons & a unique battling system. Journey along with Virginia, Jet, Clive and Gallows and discover the mystery behind the Prophets to revive the memories of Filgaia. Explore dungeons to unlock secret pathways and find mythical treasures. Gun Blazing shoot-outs deliver intense cinematic battles. Wild Arms 3 embodies tried-and-true elements of a role-playing classic.",Wild Arms 3
0,60,0,0,,1.8666666666666667,,,0.0,0.0,0.0,https://images.igdb.com/igdb/image/upload/t_original/cyy9rcio5gwkasphr0ap.png,Funselektor Labs,,https://images.igdb.com/igdb/image/upload/t_original/co286i.png,Funselektor Labs,,Collection,"In Absolute Drift, you will master the art of drifting. Practice your skills in Free-Roam and compete in drift events such as Driftkhana and Mountain Drifting.",Absolute Drift
7,82,0,0,,0.4,2017-09-06,,0.0,0.0,0.0,https://images.igdb.com/igdb/image/upload/t_original/m9mdkmpv1efkc2nmxqlt.png,Bungie,PS4,https://images.igdb.com/igdb/image/upload/t_original/co67qb.png,Activision,,Collection,"Dive into the world of Destiny 2 to explore the mysteries of the solar system and experience responsive first-person shooter combat. Unlock powerful elemental abilities and collect unique gear to customize your Guardian's look and playstyle. Enjoy Destiny 2’s cinematic story, challenging co-op missions, and a variety of PvP modes alone or with friends. Download for free today and write your legend in the stars.",Destiny 2
1,84,0,0,,3.55,2015-11-10,,0.0,0.0,0.0,https://images.igdb.com/igdb/image/upload/t_original/twgwp1xobnae4kbky2hw.png,Bethesda Game Studios,PS4,https://images.igdb.com/igdb/image/upload/t_original/co1yc6.png,Bethesda Softworks,,Collection,"Bethesda Game Studios welcome you to the world of Fallout 4, their most ambitious game ever, and the next generation of open-world gaming. As the sole survivor of Vault 111, you enter a world destroyed by nuclear war. Every second is a fight for survival, and every choice is yours. Only you can rebuild and determine the fate of the Wasteland. Welcome home.",Fallout 4
0,70,0,0,,0.03333333333333333,2016-02-02,,0.0,0.0,0.0,https://images.igdb.com/igdb/image/upload/t_original/ypq3rawuahjnxiw6gaz4.png,Roll7,PS4,https://images.igdb.com/igdb/image/upload/t_original/co2gjr.png,Devolver Digital,,Collection,"Professional assassin turned amateur campaign manager Steve is charged with cleaning up the city by an anthropomorphic rabbit and mayoral candidate from the future named BunnyLord. Now Steve and his expanding roster of dubious heroes must wield their unique skills to shoot, slide, dive and take cover behind a political platform built on ethics, accountability, and an inordinate amount of gunfire. Eliminate the criminal underworld of the city’s three major districts and persuade undecided voters to your cause, tackling the issues that matter by putting a gun in the mouth of those issues. Through the power of ISO-Slant technology and a wasted youth, London-based developer Roll7 (OlliOlli) delivers the greatest 2¼D cover-based indie shooter of all-time, ever.",Not a Hero
0,86,0,0,,4.383333333333334,2015-09-09,,0.0,0.0,0.0,https://images.igdb.com/igdb/image/upload/t_original/hm2dakninmziwpxp3urp.png,Media Molecule,PS4,https://images.igdb.com/igdb/image/upload/t_original/co1nfd.png,Sony Computer Entertainment,,Collection,"Journey through a vibrant, living papery world, with a plucky messenger who has a unique message to deliver - to you! Choose to guide either atoi or iota on this adventure, each a bold courier with an expressive personality and a unique message for you locked away inside their envelope head. In order to read it though, they're going to need your help to deliver it!",Tearaway: Unfolded
0,85,0,0,,33.88333333333333,2015-10-08,,0.0,0.0,0.0,https://images.igdb.com/igdb/image/upload/t_original/uqgvxu06y3brb5jlvowl.png,Naughty Dog,PS4,https://images.igdb.com/igdb/image/upload/t_original/co1tps.png,Sony Computer Entertainment,,Collection,"Uncharted: The Nathan Drake Collection is a remastered compilation of the action-adventure shooter platform video games Drake's Fortune, Among Thieves, and Drake's Deception. Ported by Bluepoint Games, the collection was released exclusively for the PlayStation 4 on October 7, 2015 in Europe and October 9th, 2015 in North America.

The Nathan Drake Collection features the original three games in the Uncharted series with 1080p resolution, 60 frames per second, better lighting, textures and models. The collection also implements a ""Photo Mode"", a mode where the player can freeze the game at any moment to take personalized screenshots, derived from Naughty Dog's other remastered entry, The Last of Us Remastered, as well as new trophies. The ported games only include their respective single-player modes.

The pre-ordered version of The Nathan Drake Collection includes the ""Nathan Drake Pack"", which consists of single-player skins of iconic Nathan Drake outfits, as well as two weapons: the Golden AK-47 and Golden 92FS - 9mm. Pre-ordering the collection as a digital download through the PlayStation Store would also give an exclusive Uncharted: The Nathan Drake Collection PlayStation 4 dynamic theme.

Purchasing The Nathan Drake Collection, and owning a valid subscription to PlayStation Plus, before the expiry date of December 13, 2015 would grant the player exclusive access to the multiplayer beta of A Thief's End.",Uncharted: The Nathan Drake Collection
0,88,0,0,,0.1,2017-03-02,,0.0,0.0,0.0,https://images.igdb.com/igdb/image/upload/t_original/fmvburhlunnhs3mdqysc.png,Guerrilla Games,PS4,https://images.igdb.com/igdb/image/upload/t_original/co2una.png,Sony Interactive Entertainment,,Collection,"Welcome to a vibrant world rich with the beauty of nature – but inhabited by awe-inspiring, highly advanced machines. As a young machine hunter named Aloy, you must unravel the mysteries of this world and find your own destiny.",Horizon Zero Dawn
5,74,0,0,,4.466666666666667,2015-09-08,,0.0,0.0,0.0,https://images.igdb.com/igdb/image/upload/t_original/erspfhfie4wh0tjau08b.png,1337 & Senri AB,PS4,https://images.igdb.com/igdb/image/upload/t_original/co2j3l.png,Tilting Point,,Collection,Leo’s Fortune is an award-winning platform adventure game where you hunt down the cunning and mysterious thief that stole your gold. Beautifully hand-crafted levels bring the story of Leo to life in this epic adventure.,Leo's Fortune
0,0,0,0,,4.766666666666667,,,0.0,0.0,0.0,https://images.igdb.com/igdb/image/upload/t_original/sc8iwk.png,Insomniac Games,,https://images.igdb.com/igdb/image/upload/t_original/co1pxp.png,Sony Interactive Entertainment,,Collection,"Experience the Game of the Year Edition of Marvel’s Spider-Man, which includes the full game, plus Marvel’s Spider-Man: The City That Never Sleeps complete DLC story arc content.

This isn’t the Spider-Man you’ve met or ever seen before. This is an experienced Peter Parker who’s more masterful at fighting big crime in New York City. At the same time, he’s struggling to balance his chaotic personal life and career while the fate of Marvel’s New York rest upon his shoulders.",Marvel's Spider-Man: Game of the Year Edition
0,75,0,0,,0.0,2018-05-24,,0.0,0.0,0.0,https://images.igdb.com/igdb/image/upload/t_original/af0hy9ukytjkqly5b5ug.png,P Studio,PS4,https://images.igdb.com/igdb/image/upload/t_original/co5cbi.png,Atlus,,Collection,Dancing game featuring characters from Persona 5.,Persona 5: Dancing in Starlight
0,84,0,0,,0.08333333333333333,2018-03-21,,0.0,0.0,0.0,https://images.igdb.com/igdb/image/upload/t_original/puyedesytuicmbqgqoir.png,Media Vision,PS4,https://images.igdb.com/igdb/image/upload/t_original/co20r6.png,Sega,,Collection,"A Continent Engulfed in the Bitter Flames of War! Commander Claude Wallace and his childhood friends set out to fight in a desperate war, but bone-chilling blizzards, waves of imperial soldiers, and the godlike powers of the Valkyria stand between them and victory.",Valkyria Chronicles 4
0,76,0,0,,0.1,2017-08-15,,0.0,0.0,0.0,https://images.igdb.com/igdb/image/upload/t_original/zlkrgd6re31fzznlqetg.png,Colossal Order,PS4,https://images.igdb.com/igdb/image/upload/t_original/co1mx3.png,Paradox Interactive,,Collection,"Cities: Skylines is a modern take on the classic city simulation genre. The game introduces new game play elements to realize the thrill and hardships of creating and maintaining a real city whilst expanding on some well-established tropes of the city building experience. From the makers of the Cities in Motion franchise, the game boasts a fully realized transport system. It also includes the ability to mod the game to suit your play style as a fine counter balance to the layered and challenging simulation. You're only limited by your imagination, so take control and reach for the sky!",Cities: Skylines
0,62,0,0,,0.03333333333333333,2016-02-29,,0.0,0.0,0.0,https://images.igdb.com/igdb/image/upload/t_original/vx9nlcvdpuwiblm59yxz.png,Tribute Games,PS4,https://images.igdb.com/igdb/image/upload/t_original/co1vud.png,Tribute Games,,Collection,"Kinuhime was killed by a ninja demon. Now, Hayate has become obsessed with revenge! But can revenge bring her back?",Ninja Senki DX
0,63,0,0,,0.18333333333333332,2016-08-30,,0.0,0.0,0.0,https://images.igdb.com/igdb/image/upload/t_original/xphmmxklgqrmzv3tqdoy.png,Kunos Simulazioni,PS4,https://images.igdb.com/igdb/image/upload/t_original/co3wib.png,Kunos Simulazioni,,Collection,"Assetto Corsa features an advanced DirectX 11 graphics engine that recreates an immersive environment, dynamic lighthing and realistic materials and surfaces. The advanced physics engine is being designed to provide a very realistic driving experience, including features and aspects of real cars, never seen on any other racing simulator such as tyre flat spots, heat cycles including graining and blistering, very advanced aerodynamic simulation with active movable aerodynamics parts controlled in real time by telemetry input channels, hybrid systems with kers and energy recovery simulation. Extremely detailed with single player and multiplayer options, exclusive licensed cars reproduced with the best accuracy possible, thanks to the official cooperation of Car Manufacturers.",Assetto Corsa
0,87,0,0,,0.43333333333333335,2014-11-18,,0.0,0.0,0.0,https://images.igdb.com/igdb/image/upload/t_original/sc8vub.png,BioWare Edmonton,PS4,https://images.igdb.com/igdb/image/upload/t_original/co2mvy.png,Electronic Arts,,Collection,"Dragon Age: Inquisition is a role-playing game and the third main game in the Dragon Age series. It is set in the Thedas continent, the same fantasy world as the two previous games. It consist of two large countries: Ferelden (from Dragon Age: Origins) and Orlais, as well as the land inbetween.

True to the spirit of the series the character can be customized for appearance, sex, class and race. The available races are dwarf, elf, human, and Qunari and the classes are mage, rogue, and warrior with three specializations each. To grow the Inquisition experience needs to be earned by completing quests, which allows the player to further define allegiances and pursue romances.

A custom party can be defined and each member benefits from experience as it opens up access to better weapons and more abilities. Power points open up new areas and Inquisition points define the influence over the region; each new level provides a perk that benefits the entire Inquisition.",Dragon Age: Inquisition
0,66,0,0,,0.08333333333333333,2015-05-01,,0.0,0.0,0.0,https://images.igdb.com/igdb/image/upload/t_original/qd9jns28ycwqztcs2ugo.png,Galapagos RPG,PS4,https://images.igdb.com/igdb/image/upload/t_original/co28bf.png,Compile Heart,,Collection,"Omega Quintet is a hybrid between an idol simulation game and a Japanese role-playing game for the PlayStation 4. The player plays as Takuto, the manager of the Verse Maidens, an idol group that use the power of song and dance to fight off a phenomenon called the ""Beep"" and save the world.",Omega Quintet
0,82,0,0,,0.08333333333333333,2015-01-27,,12.069444444444445,11.533055555555556,10.773888888888889,https://images.igdb.com/igdb/image/upload/t_original/hu5bxodqypmlee03ez9a.png,Double Fine Productions,Vita,https://images.igdb.com/igdb/image/upload/t_original/co27pj.png,Double Fine Productions,,C Play Later,"Something's rotten in the land of the dead, and you're being played for a sucker. Meet Manny Calavera, travel agent at the Department of Death. He sells luxury packages to souls on their four-year journey to eternal rest. But there's trouble in paradise. Help Manny untangle himself from a conspiracy that threatens his very salvation.

One of the most acclaimed adventure games of all time is now back, better than ever. Grim Fandango's epic story of four years in the life (or death) of Manny Calavera, travel agent to the dead, has been remastered to look, sound, and control even better than when it won GameSpot's Game of the Year award upon its original launch. Grim Fandango still stands as a classic of the genre, with unforgettable characters and unique combination of film noir and Mexican folklore.",Grim Fandango Remastered
100,96,2,10,2021-10-10,1.3833333333333333,2018-09-18,2021-10-08,20.810555555555556,10.936388888888889,6.760277777777778,https://images.igdb.com/igdb/image/upload/t_original/tz5ypjqhppmtypognq7o.png,tobyfox,Switch,https://images.igdb.com/igdb/image/upload/t_original/co2855.png,8-4,,Completed,"A small child falls into the Underground, where monsters have long been banished by humans and are hunting every human that they find. The player controls the child as they try to make it back to the Surface through hostile environments, all the while engaging with a turn-based combat system with puzzle-solving and bullet hell elements, as well as other unconventional game mechanics.",Undertale
0,66,0,0,,0.21666666666666667,2019-03-14,,0.0,0.0,0.0,https://images.igdb.com/igdb/image/upload/t_original/i3lcwd55hhzxlcvsiyaa.png,Ganbarion,PS4,https://images.igdb.com/igdb/image/upload/t_original/co1syt.png,Bandai Namco Entertainment,,Collection,"Set sail on an all-new ONE PIECE adventure in ONE PIECE World Seeker! Luffy and the Straw Hat Pirates are back in a new story that puts players’ into Luffy’s point of view, as he battles and explores an expansive and seamless world. Open landscapes provide many paths for players to experience Luffy’s gum-gum abilities and swing into action.",One Piece: World Seeker
