Completion %,Critic Rating,Format,My Rating,Date Finished,Hours Played,Release Date,Date Started,HLTB Complete,HLTB Extras,HLTB Story,Banner URL,Developer,Platform,Poster URL,Publisher,Review,Status,Summary,Title
0,65,0,0,,0.0,2012-11-19,,0.0,0.0,0.0,https://images.igdb.com/igdb/image/upload/t_original/hiwomwo4hw2es0ol2eia.png,Tomorrow Corporation,PC,https://images.igdb.com/igdb/image/upload/t_original/co253v.png,Experimental Gameplay,,Collection,"Congratulations on your new Little Inferno Entertainment Fireplace! Throw your toys into your fire, and play with them as they burn. Stay warm in there. It's getting cold outside! Burn flaming logs, screaming robots, credit cards, batteries, exploding fish, unstable nuclear devices, and tiny galaxies. An adventure that takes place almost entirely in front of a fireplace - about looking up up up out of the chimney, and the cold world just on the other side of the wall.",Little Inferno
0,80,0,0,,0.0,2013-04-30,,0.0,0.0,0.0,https://images.igdb.com/igdb/image/upload/t_original/pwozgv6roug1icdqih5y.png,Owlchemy Labs,PC,https://images.igdb.com/igdb/image/upload/t_original/co23vk.png,Owlchemy Labs,,Collection,"A tree killed his granny and now he is out for revenge. Meet Jack Lumber, the supernatural lumberjack who hates trees, loves animals, and hates trees. Did we say that twice? The guy really hates trees, and boy does he have an axe to grind.

Use the supernatural powers of Jack Lumber to massacre the forest in this time-warping, line-drawing, log-slicing, pun-filled lumberjacking mashup! Bust out your flannel to muster the strength and burlyness to solve the skill and logic puzzles (flannel not actually required).

Fight the forest and make Granny proud! Eff trees!",Jack Lumber
0,85,0,0,,0.0,2009-02-03,,0.0,0.0,0.0,https://images.igdb.com/igdb/image/upload/t_original/vvhljgcrpoywilxo1jvx.png,Criterion Games,PC,https://images.igdb.com/igdb/image/upload/t_original/co28fc.png,Electronic Arts,,Collection,"Burnout Paradise The Ultimate Box brings together the best console racing game of 2008, Burnout Paradise, with a host of great new content including motorbikes and exciting new online modes and challenges.

PC owners can look forward to spectacular visuals, incredible high speed racing, outrageous bone jarring crashes and a lifetime's worth of fun and challenging online modes for up to 8 players to enjoy.

Players can also keep up to date with all the latest news and developments through the new Criterion Games Network and get the latest new game updates from the in game Burnout Store.",Burnout Paradise: The Ultimate Box
0,83,0,0,,0.0,2019-09-03,,0.0,0.0,0.0,https://images.igdb.com/igdb/image/upload/t_original/pg8nr1woss0timdwtee8.png,Toys for Bob,PC,https://images.igdb.com/igdb/image/upload/t_original/co1tjo.png,Activision,,Collection,"Spyro Reignited Trilogy is a collection of remasters of the first three games in the Spyro series: Spyro the Dragon (1998), Ripto's Rage! (1999), and Year of the Dragon (2000).",Spyro Reignited Trilogy
0,91,0,0,,0.0,2004-11-16,,0.0,0.0,0.0,https://images.igdb.com/igdb/image/upload/t_original/mpphkihhk8yh9m2zaafd.png,Valve,PC,https://images.igdb.com/igdb/image/upload/t_original/co1nmw.png,Sierra Entertainment,,Collection,"1998. HALF-LIFE sends a shock through the game industry with its combination of pounding action and continuous, immersive storytelling.

NOW. By taking the suspense, challenge and visceral charge of the original, and adding startling new realism and responsiveness, Half-Life 2 opens the door to a world where the player's presence affects everything around them, from the physical environment to the behaviors even the emotions of both friends and enemies.",Half-Life 2
0,85,0,0,,0.0,2010-03-23,,0.0,0.0,0.0,https://images.igdb.com/igdb/image/upload/t_original/mmbloztoprcx0u7z2mtj.png,Avalanche Studios,PC,https://images.igdb.com/igdb/image/upload/t_original/co1qri.png,Eidos Interactive,,Collection,"In a lawless open-world paradise, use whatever means necessary to achieve your objective. Use land, sea and air to your advantage and use a wide range of weaponry to cause as much chaos as possible.",Just Cause 2
0,90,0,0,,0.0,2008-02-15,,0.0,0.0,0.0,https://images.igdb.com/igdb/image/upload/t_original/l7xmouinp5fyefkldqi3.png,Dylan Fitterer,PC,https://images.igdb.com/igdb/image/upload/t_original/co1ud3.png,,,Collection,"Audiosurf is a puzzle/rhythm hybrid game created by Invisible Handlebar, a personal company created by Dylan Fitterer. It's track-like stages visually mimic the music the player chooses, while the player races across several lanes collecting colored blocks that appear in sync with the music. The music used in the game is chosen from the user's own library, from almost any DRM-free format, as well as standard redbook CDs; in addition, Audiosurf includes the entire soundtrack to The Orange Box as part of the download.",Audiosurf
0,0,0,0,,0.0,2009-06-12,,0.0,0.0,0.0,https://images.igdb.com/igdb/image/upload/t_original/xkl9ontqsshj51dmvhpu.png,Dovetail Games,PC,https://images.igdb.com/igdb/image/upload/t_original/co1yih.png,Dovetail Games,,Collection,"Train Simulator fully immerses you in a World of trains, transporting you to a place where you decide what to do, where and when. Experience the challenge of mastering a wide variety of different locos and learning the routes in every direction. Unlock your creative potential using powerful tools to create your very own routes and scenarios and enjoy your collection from the perspective of the driver, passenger or railfan. Whatever you love about trains, Train Simulator has it covered.

The core game has received an update every year since release, including major new versions; RailWorks 2: Train Simulator, RailWorks 3: Train Simulator 2012, Train Simulator 2013, Train Simulator 2014... and go one.",Train Simulator
0,78,0,0,,0.0,2018-06-29,,44.88111111111111,23.01527777777778,14.977222222222222,https://images.igdb.com/igdb/image/upload/t_original/eowe31243hyvihdvrtzl.png,Vicarious Visions,Switch,https://images.igdb.com/igdb/image/upload/t_original/co1v62.png,Activision,,C Play Later,"Crash Bandicoot N. Sane Trilogy is a remastered version, of the original 3 games (Crash Bandicoot, Crash Bandicoot 2: Cortex Strikes Back, and Crash Bandicoot 3: Warped) with enhanced features applied to each game.",Crash Bandicoot N. Sane Trilogy
0,80,0,0,,0.0,2007-10-10,,0.0,0.0,0.0,https://images.igdb.com/igdb/image/upload/t_original/x7pzfljardlljvtqcgv4.png,Valve,PC,https://images.igdb.com/igdb/image/upload/t_original/co1x7d.png,Valve,,Collection,"Waking up in a seemingly empty laboratory, the player is made to complete various physics-based puzzle challenges through numerous test chambers in order to test out the new Aperture Science Handheld Portal Device, without an explanation as to how, why or by whom.",Portal
0,85,0,0,,0.0,2002-05-01,,0.0,0.0,0.0,https://images.igdb.com/igdb/image/upload/t_original/oa1aojyglfomtmei2bnz.png,Bethesda Game Studios,PC,https://images.igdb.com/igdb/image/upload/t_original/co2knd.png,ZeniMax Media,,Collection,"First-person WRPG and third mainline entry in the Elder Scrolls franchise in which the player arrives in the island of Vvardenfell, an exotic land plagued by disease-carrying storms and ruled by a godly Tribunal, in the Morrowind province of Tamriel, and takes part in the prophecy foretelling the second coming of Nerevar, who will supposedly save Morrowind from malicious clans both within and outside Vvardenfell.",The Elder Scrolls III: Morrowind
0,74,0,0,,0.0,2015-09-16,,0.0,0.0,0.0,https://images.igdb.com/igdb/image/upload/t_original/mo3cvps8hcqjtyq39zrk.png,Flazm,PC,https://images.igdb.com/igdb/image/upload/t_original/co2h15.png,Flazm,,Collection,"Build railways, manage traffic and stay accident-free! Play in Europe, America, Japan and USSR in the period from 1830 to 2020. Complete the story mode from the Gold Rush of 1849 to the first manned spaceflight, and then explore the random mode. Management. Construction. Trains. Welcome to Train Valley!",Train Valley
0,72,0,0,,0.0,2010-08-24,,0.0,0.0,0.0,https://images.igdb.com/igdb/image/upload/t_original/xtmuuthx1emzj6qqscal.png,2K Czech,PC,https://images.igdb.com/igdb/image/upload/t_original/co2n13.png,2K Games,,Collection,"The storyline for Mafia II is a gritty drama and chronicles the rise of Vito Scaletta, the son of Sicilian immigrants. As the game progresses, Vito joins the Falcone crime family and becomes ""a made man"" along with his best friend Joe Barbaro.",Mafia II
0,95,0,0,,0.0,2002-05-20,,0.0,0.0,0.0,https://images.igdb.com/igdb/image/upload/t_original/sch5km.png,DMA Design,PC,https://images.igdb.com/igdb/image/upload/t_original/co2lb8.png,Rockstar Games,,Collection,"Featuring a fully 3-D living city, a combination of narrative driven and non-linear gameplay and a completely open environment, Grand Theft Auto III represents a huge leap forward in interactive entertainment. For the first time, players are put at the heart of their very own gangster movie, and let loose in a fully-realised 3 dimensional city, in which anything can happen and probably will.

With a cast of hundreds, 50 plus vehicles, ranging from sports cars to ice cream trucks and from boats to buses, 3 hours of music, including opera, reggae, house, drum and bass, pop and disco, a huge array of street ready weapons and some of the seediest characters in video game history, Grand Theft Auto 3 is a sprawling epic which will show you that sometimes, crime can pay and sometimes it can pay you back. Available now for PlayStation2, Xbox, PC and Macintosh.",Grand Theft Auto III
0,0,0,0,,0.0,2011-03-04,,0.0,0.0,0.0,https://images.igdb.com/igdb/image/upload/t_original/edme64x6i3kizqhfws3t.png,United Game Artists,PC,https://images.igdb.com/igdb/image/upload/t_original/co1mw1.png,Sega,,Collection,"Hey there, SpaceCats – meet Ulala, the grooviest reporter in the galaxy! She’s got attitude, and she’s got moves. Help her get the scoop on an unidentified Dance Troupe that has captured thousands of people and is forcing them to dance!",Space Channel 5: Part 2
0,85,0,0,,0.0,2008-10-21,,0.0,0.0,0.0,https://images.igdb.com/igdb/image/upload/t_original/inexpbkvkno0mj5jirxx.png,Ubisoft Montreal,PC,https://images.igdb.com/igdb/image/upload/t_original/co1vpo.png,,,Collection,"A civil war has swept through the country and you're caught in the middle of it. Track down the person at the forefront of the fighting, a ruthless arms dealer known only as ""The Jackal"". As you undertake deadly missions and form fragile alliances with conflicting rebel groups, one thing becomes clear - the Jackal is hunting you too.",Far Cry 2
0,0,0,0,,0.0,2017-12-01,,0.0,0.0,0.0,https://images.igdb.com/igdb/image/upload/t_original/v9jhs8kafnatftzo0tg1.png,Slug Disco,PC,https://images.igdb.com/igdb/image/upload/t_original/co24rb.png,Slug Disco,,Collection,"Lead your Ant Colony to Dominance!

Empires of the Undergrowth is an ant colony management game, in a fast-paced real-time strategy style. The player excavates their nest underground, constructing tunnels and chambers to store food and raise brood. On the surface, the ants claim territory, gather resources, overwhelm fearsome arachnids and clash with other colonies. Nest design, army size, composition and attack timing are key to securing victory.

Missions are narrated from the perspective of a documentary film maker studying the ants, who offers intelligent insight into the goings-on of the colony and the undergrowth beyond. The primary game mode in early access is Formicarium, where you take ownership of a home colony of unique DNA-harvesting ants as they work to assimilate the desirable traits of their foes. You can upgrade them by playing one-off missions, sometimes with your home colony and sometimes with other ant species.",Empires of the Undergrowth
0,81,0,0,,0.0,2014-10-09,,0.0,0.0,0.0,https://images.igdb.com/igdb/image/upload/t_original/iuzxwzy9osqcjglv3oo9.png,Square Enix,PC,https://images.igdb.com/igdb/image/upload/t_original/co2ukg.png,Square Enix,,Wanted,"As a deepening crisis threatens to plunge the floating world of Cocoon into chaos, a band of unsuspecting strangers find themselves branded enemies of the state. With the panicking population baying for their blood, and the military all too happy to oblige, they have no choice but to run for their lives. Join them on a desperate quest to challenge the forces controlling their fate, and prevent untold destruction.

Featuring an unforgettable storyline, a battle system blending action and strategy, cutting-edge visuals and awe-inspiring cinematic sequences, FINAL FANTASY XIII delivers the next step in the evolution of gaming.",Final Fantasy XIII
0,0,0,0,,0.0,2023-12-31,,0.0,0.0,0.0,https://images.igdb.com/igdb/image/upload/t_original/schqit.png,Jesse Makkonen,PC,https://images.igdb.com/igdb/image/upload/t_original/co571i.png,Gamera Games,,Wanted,"Afterdream is a 2D psychological horror adventure game.

Navigate the obscure location populated by ghosts, and collect items to solve puzzles as you move further through the intriguing story. Look through the lens of your strange camera and photograph highlighted objects to interact with them.",Afterdream
6,80,0,0,,0.0,2018-08-28,,0.0,0.0,0.0,https://images.igdb.com/igdb/image/upload/t_original/mrutpxesdu9k7soeivx6.png,Ben Esposito,PC,https://images.igdb.com/igdb/image/upload/t_original/co1qv8.png,Annapurna Interactive,,Collection,"Donut County is a story-based physics puzzle game where you play as an ever-growing hole in the ground. Meet cute characters, steal their trash, and throw them in a hole.",Donut County
0,80,0,0,,0.0,,,0.0,0.0,0.0,https://images.igdb.com/igdb/image/upload/t_original/sc9dfm.png,Cold Symmetry,,https://images.igdb.com/igdb/image/upload/t_original/co2yhh.png,Playstack,,Collection,"Mortal shell is a ruthless and deep action-RPG that tests your sanity and resilience in a shattered world. As the remains of humanity wither and rot, zealous foes fester in the ruins. They spare no mercy, with survival demanding superior awareness, precision and instincts. Track down hidden sanctums of devout followers and discover your true purpose. Possess Lost warriors the Lost remains of defeated warriors are yours to discover. Awaken these Mortal shells, occupy their bodies and significantly open your understanding to diverse masteries of combat. Face formidable foes your path is guarded by adversaries, devoted to inscrutable gods. Behold creatures both pitiable and grotesque and muster your courage and face them down. Iron sharpens Iron combat is strategic, deliberate, and unforgiving. Commit your sword only when an opportunity opens.",Mortal Shell: Enhanced Edition
2,84,0,0,,0.0,2020-11-20,,0.0,0.0,0.0,https://images.igdb.com/igdb/image/upload/t_original/sc5mbr.png,MONKEYCRAFT Co. Ltd,XONE,https://images.igdb.com/igdb/image/upload/t_original/co25sm.png,Bandai Namco Entertainment,,Collection,"When the King of All Cosmos accidentally destroys all the stars in the sky, he orders you, his pint-sized princely son, to put the twinkle back in the heavens above. Join the King and Prince of Cosmos on their wacky adventure to restore the stars at home or on the go – now in full HD!",Katamari Damacy Reroll
0,88,0,0,,0.0,2022-01-12,,0.0,0.0,0.0,https://images.igdb.com/igdb/image/upload/t_original/sc8ky2.png,Capcom Development Division 2,PC,https://images.igdb.com/igdb/image/upload/t_original/co3uzk.png,Capcom,,Collection,"Rise to the challenge and join the hunt! In Monster Hunter Rise, the latest installment in the award-winning and top-selling Monster Hunter series, you’ll become a hunter, explore brand new maps and use a variety of weapons to take down fearsome monsters as part of an all-new storyline.",Monster Hunter Rise
0,77,0,0,,0.0,2019-08-27,,0.0,0.0,0.0,https://images.igdb.com/igdb/image/upload/t_original/iey06e89dqp3jcm1kzgy.png,Bugbear Entertainment,XONE,https://images.igdb.com/igdb/image/upload/t_original/co3vof.png,THQ Nordic,,Collection,"Wreckfest is a demolition derby themed racing game with soft-body damage modeling, sophisticated driving dynamics and in-depth vehicle upgrading, featuring both demolition derbies and more traditional track races. It’s all about fun, breakneck racing and over-the-top crashes.",Wreckfest
0,80,0,0,,0.0,2006-12-07,,0.0,0.0,0.0,https://images.igdb.com/igdb/image/upload/t_original/vfyy49mvh6vskugeiwfg.png,Mistwalker,X360,https://images.igdb.com/igdb/image/upload/t_original/co1qad.png,Microsoft Game Studios,,Collection,"""Hironobu Sakaguchi, the Father of the Final Fantasy series, and Artoon present the world of Blue Dragon on Xbox 360. Featuring the character design of Akira Toriyama, the Father of ""Dragon Ball Z"", and music by Nobuo Uematsu, the composer for Final Fantasy, Blue Dragon is an epic role-playing game (RPG) centered on five youngsters who possess miraculous strength and magical power to control shadow creatures that mirror the actions of their masters.""

Blue Dragon follows the story of five friends (Shu, Jiro, Kluke, Zola, and Marumaro) as they travel across the world to confront Nene, the evil ruler of the Grand Kingdom. The setting inspired separate anime and manga adaptations, although these follow the story to different degrees and feature a different cast of characters. The game follows a traditional role-playing design, based around exploration and turn-based combat.

The gameplay of Blue Dragon uses turn-based gameplay elements seen in older Japanese role-playing video games. The game world contains two major types of areas: towns, in which the player can rest and purchase items, and dungeon-like areas, with numerous foes to be defeated.",Blue Dragon
0,85,0,0,,0.0,2019-10-25,,0.0,0.0,0.0,https://images.igdb.com/igdb/image/upload/t_original/sc5r8b.png,Obsidian Entertainment,XONE,https://images.igdb.com/igdb/image/upload/t_original/co2eew.png,Private Division,,Collection,"The Outer Worlds is a new single-player sci-fi RPG from Obsidian Entertainment and Private Division. As you explore the furthest reaches of space and encounter a host of factions all vying for power, who you decide to become will determine the fate of everyone in Halcyon. In the corporate equation for the colony, you are the unplanned variable.",The Outer Worlds
0,90,0,0,,0.0,2018-10-02,,0.0,0.0,0.0,https://images.igdb.com/igdb/image/upload/t_original/sc8fvc.png,Playground Games,PC,https://images.igdb.com/igdb/image/upload/t_original/co2e1a.png,Xbox Game Studios,,Collection,"Dynamic seasons change everything at the world’s greatest automotive festival. Go it alone or team up with others to explore beautiful and historic Britain in a shared open world. Collect, modify and drive over 450 cars. Race, stunt, create and explore – choose your own path to become a Horizon Superstar.",Forza Horizon 4
0,76,0,0,,0.0,2021-03-26,,0.0,0.0,0.0,https://images.igdb.com/igdb/image/upload/t_original/paziprfetq1rld7dqc0s.png,Feral Cat Den,XONE,https://images.igdb.com/igdb/image/upload/t_original/co2y2b.png,Fellow Traveller,,Collection,"A noir adventure spanning time and space.
You play as No Man, a watch peddler caught in a love triangle with other cosmic beings, Miss Mass and Golden Boy. When your affair turns into a bitter confrontation, you will witness a gunshot fired by a jealous god—otherwise known as The Big Bang. Jump into the expanding universe and search for a way to prevent or destroy creation and save your love.",Genesis Noir
5,84,0,0,,0.0,2010-09-08,,0.0,0.0,0.0,https://images.igdb.com/igdb/image/upload/t_original/scke5y.png,PopCap Games,X360,https://images.igdb.com/igdb/image/upload/t_original/co69id.png,PopCap Games,,Collection,"Zombies are invading your home, and the only defense is your arsenal of plants! Armed with an alien nursery-worth of zombie-zapping plants like peashooters and cherry bombs, you'll need to think fast and plant faster to stop dozens of types of zombies dead in their tracks.",Plants vs. Zombies
2,80,0,0,,0.0,2019-02-05,,63.62972222222222,46.99027777777778,21.218611111111112,https://images.igdb.com/igdb/image/upload/t_original/sci95n.png,System Era Softworks,PC,https://images.igdb.com/igdb/image/upload/t_original/co1niz.png,System Era Softworks,,Collection,"Explore and exploit distant worlds in a game of aerospace industry and interplanetary exploration. With your gun you can reshape the landscape around you and gather resources. On your journey you come across special artifacts that will provide you with research points, in order to unlock new technologies. These include rovers and spaceships, in order the expand your reach on the planets in the solar system. The game also has a co-op mode, allowing players to explore the planets with their friends.",Astroneer
0,85,0,0,,0.0,2022-10-27,,0.0,0.0,0.0,https://images.igdb.com/igdb/image/upload/t_original/fofzalqb3kyoh5j25kqx.png,rose-engine,PC,https://images.igdb.com/igdb/image/upload/t_original/co62ig.png,Humble Games,,Collection,"Signalis is a classic survival horror experience with a unique aesthetic, full of melancholic mystery. Investigate a dark secret, solve puzzles, fight off nightmarish creatures and navigate dystopian, surreal retrotech worlds as Elster, a technician Replika searching for her lost dreams.",Signalis
0,92,0,0,,0.0,2016-07-07,,0.0,0.0,0.0,https://images.igdb.com/igdb/image/upload/t_original/z4fkserflyby1nv5ispe.png,Playdead,PC,https://images.igdb.com/igdb/image/upload/t_original/co2fca.png,Playdead,,Collection,"An atmospheric 2D side-scroller in which, hunted and alone, a boy finds himself drawn into the center of a dark project and struggles to preserve his identity.",Inside
1,72,0,0,,0.0,,,0.0,0.0,0.0,https://images.igdb.com/igdb/image/upload/t_original/wkljqqzv3jsaxjl0z4f7.png,Pandemic Studios,,https://images.igdb.com/igdb/image/upload/t_original/co2h1z.png,LucasArts,,Collection,"Star Wars: Battlefront is the first in the Star Wars: Battlefront series and is a third/first-person shooter video game based around battles featured in the Star Wars movies. It was developed by Pandemic Studios and LucasArts, and released on September 20, 2004 for Xbox (playable on Xbox 360), PlayStation 2, and PC, the same day as the release of the Star Wars Trilogy (DVD) set. Players can either play Star Wars: Battlefront online, or offline with up to 4 players (on consoles).",Star Wars: Battlefront
1,94,0,0,,0.0,2021-11-09,,0.0,0.0,0.0,https://images.igdb.com/igdb/image/upload/t_original/scahhi.png,Playground Games,PC,https://images.igdb.com/igdb/image/upload/t_original/co3ofx.png,Xbox Game Studios,,Collection,"Your Ultimate Horizon Adventure awaits! Explore the vibrant and ever-evolving open-world landscapes of Mexico with limitless, fun driving action in hundreds of the world’s greatest cars.",Forza Horizon 5
0,81,0,0,,0.0,2021-09-16,,0.0,0.0,0.0,https://images.igdb.com/igdb/image/upload/t_original/sc6wcz.png,Pixpil Studio,PC,https://images.igdb.com/igdb/image/upload/t_original/co3tul.png,Chucklefish Games,,Collection,"Eastward is a beautifully detailed and charming adventure RPG, from Shanghai-based indie developers, Pixpil and published by Chucklefish.

Escape the tyrannical clutches of a subterranean society and join Eastward’s unlikely duo on an exciting adventure to the land above! Discover beautiful yet bizarre settlements and make new friends as you travel across the world by rail.

Inspired by 90s Japanese animation, the visual style of Eastward has been brought to life using a combination of a modern, innovative 3D lighting system and a rich retro-pixel artwork.",Eastward
10,85,0,0,,0.0,2022-06-16,,0.0,0.0,0.0,https://images.igdb.com/igdb/image/upload/t_original/sc94kz.png,Tribute Games,PC,https://images.igdb.com/igdb/image/upload/t_original/co4w87.png,DotEmu,,Collection,"Teenage Mutant Ninja Turtles: Shredder's Revenge reunites Leonardo, Raphael, Michelangelo, and Donatello to kick shell in a beautifully realized pixel art world invoking the turtles' classic 1987 design.",Teenage Mutant Ninja Turtles: Shredder's Revenge
0,72,0,0,,0.0,2020-05-22,,0.0,0.0,0.0,https://images.igdb.com/igdb/image/upload/t_original/baxkukehxt0rtwnfhlrz.png,Tripwire Interactive,PC,https://images.igdb.com/igdb/image/upload/t_original/co1lx6.png,Tripwire Interactive,,Collection,"You were cut from your mother's body and left to die in the unforgiving waters of the Gulf Coast. Your only tools are your wits, your jaws, and an uncanny ability to evolve as you feed. Anything and everything is on the menu... provided you kill it before it kills you.",Maneater
0,0,0,0,,0.0,2020-03-13,,0.0,0.0,0.0,https://images.igdb.com/igdb/image/upload/t_original/sc8el5.png,Undead Labs,PC,https://images.igdb.com/igdb/image/upload/t_original/co2cgx.png,Xbox Game Studios,,Collection,"The dead have risen and civilization has fallen. Now it's up to you to gather survivors, scavenge for resources and build a community with up to three of your friends in a post-apocalyptic world – a world where you define what it means to survive in this ultimate zombie survival simulation.",State of Decay 2: Juggernaut Edition
76,0,0,0,,0.0,2022-12-06,,0.0,0.0,0.0,https://images.igdb.com/igdb/image/upload/t_original/sc8g7v.png,Eerie Guest Studios,PC,https://images.igdb.com/igdb/image/upload/t_original/co2e66.png,tinyBuild,,Collection,"Hello Neighbor 2 is a stealth horror game where you're being stalked by a mysterious creature as you try to track down Mr. Peterson (The Neighbor) who has disappeared after the events of the first game. Play against an advanced, self-learning AI that tracks and adapts to your every move.",Hello Neighbor 2
