Completion %,Critic Rating,Format,My Rating,Date Finished,Hours Played,Release Date,Date Started,HLTB Complete,HLTB Extras,HLTB Story,Banner URL,Developer,Platform,Poster URL,Publisher,Review,Status,Summary,Title
0,72,0,0,,0.0,2017-06-30,,0.0,0.0,0.0,https://images.igdb.com/igdb/image/upload/t_original/nqijxtq9cc3qbssjb4kg.png,Nihon Falcom,Vita,https://images.igdb.com/igdb/image/upload/t_original/co1oqt.png,Aksys Games,,Backlog,"Tokyo Xanadu is an upcoming Japanese role-playing video game for the PlayStation Vita. The game plays as an action role-playing video game with many elements from the Persona series of games. It has a party-based battle system with randomly generated dungeons. 
 
An enhanced version, titled Tokyo Xanadu eX+, was developed for PS4 and Windows. It has a new playable character with new scenarios, enemies, bosses, and dungeons. It also includes two new play modes, Time Attack and Boss Rush.",Tokyo Xanadu
0,0,0,0,,0.0,2014-02-21,,0.0,0.0,0.0,https://images.igdb.com/igdb/image/upload/t_original/cgvfryd131pzo9tz5yqd.png,,Vita,https://images.igdb.com/igdb/image/upload/t_original/co1l5r.png,,,Backlog,"A bustling town deep in the frontier at the foot of an endless sea of trees... It is into this wild and untamed setting that a young man collapses, memories gone and only his name to guide him.

Bereft of his past, Adol Cristin wanders the town of Casnan searching for clues to his identity. Joined by an information dealer who claims to have known him, the young adventurer helps rescue doomed miners from a collapse; an act which attracts the attention of the Romun Army general in town. Impressed with their skills, the pair is enlisted to explore the Great Forest and map the vast expanses of Celceta – a task which many have attempted in the past, but from which none have ever returned alive.

Alone in this strange and uncharted frontier, Adol must brave the perilous sea of trees as he struggles to regain his memories and decide whom he can trust, and who is simply attempting to take advantage of his memory loss in order to deceive him...",Ys: Memories of Celceta
0,0,0,0,,0.0,2011-11-23,,0.0,0.0,0.0,https://images.igdb.com/igdb/image/upload/t_original/yv58jjuohi02jjjhunky.png,,PSP,https://images.igdb.com/igdb/image/upload/t_original/co2fcm.png,,,Backlog,"7th Dragon 2020 is a Japanese role-playing game and a spin-off sequel to the original 7th Dragon. It changes the setting from 7th Dragon's generic fantasy world to post-apocalyptic Tokyo, and ditches the 2D sprites for an entirely 3D graphics. Despite the change in setting, the basic story is largely identical - the world has been invaded by dragons, bringing with them a brand of poisonous flowers. As a group of survivors known as Murakamo 13, you must search through the wreckage of the various districts of Tokyo to find other refugees, kill lots of dragons, and contend with a rival group of humans known as SKY.",7th Dragon 2020
0,0,0,0,,0.0,2013-04-18,,0.0,0.0,0.0,https://images.igdb.com/igdb/image/upload/t_original/mgum75ttocthpsrz4bhb.png,,PSP,https://images.igdb.com/igdb/image/upload/t_original/co2nh8.png,,,Backlog,"7th Dragon 2020-II is a Japanese role-playing game and the sequel to 7th Dragon 2020. Set a year after the events of the first game, Murakumo has moved its main base from the Metropolitan Government Building and is focusing on rebuilding. Squad 13 is called to the Tokyo Sky Tower to rid of some monsters to help the rebuilding process in the tower. However, a portal appears at the top of the Sky Tower and Dragons appear once more to strike down humanity.",7th Dragon 2020-II
0,0,0,0,,0.0,2006-06-23,,0.0,0.0,0.0,https://images.igdb.com/igdb/image/upload/t_original/sc8wvb.png,,PSP,https://images.igdb.com/igdb/image/upload/t_original/co2nhs.png,,,Backlog,"In Astonishia Story, players embody an honorable royal knight and embark upon an epic journey to recover a stolen sacred relic that symbolizes prosperity and fortune. Players must seek the help of wizards and many other mysterious allies to succeed.",Astonishia Story
0,0,0,0,,0.0,2012-09-23,,0.0,0.0,0.0,https://images.igdb.com/igdb/image/upload/t_original/scd4mn.png,,PSP,https://images.igdb.com/igdb/image/upload/t_original/co3som.png,,,Backlog,"Bakemonogatari Portable is a video game adaptation of the Bakemonogatari anime series, released for the PlayStation Portable.",Bakemonogatari Portable
0,82,0,0,,0.0,2006-07-04,,0.0,0.0,0.0,https://images.igdb.com/igdb/image/upload/t_original/schdtx.png,Game Republic Inc.,PSP,https://images.igdb.com/igdb/image/upload/t_original/co4epl.png,XSEED Games,,Backlog,"On a day that starts out like any other, an 11-year-old boy's life is changed forever when his friend Miki suddenly collapses from an unknown illness. Without the means to save her, he grows increasingly distraught when suddenly, a strange voice offers him a second chance: ""Beyond the door you can change your destiny!"" He soon leaves the real world and journeys to the world of Vision, where, as a novice ""Traveler,"" he will surmount myriad ordeals in hopes of ultimately meeting with the Goddess of Fortune to have a single wish granted.",Brave Story: New Traveler
0,0,0,0,,0.0,2006-02-03,,91.48444444444445,48.06444444444445,40.68194444444445,https://images.igdb.com/igdb/image/upload/t_original/schnqy.png,Capcom,PSP,https://images.igdb.com/igdb/image/upload/t_original/co4xsn.png,Capcom,,Backlog,"Capcom's third installment of its epic RPG. Breath of Fire III is the first installment of the Breath of Fire Series to appear on the PlayStation (And later ported to the PSP).

Set free by the the workers of Dauna Mine, Ryu of the Brood learns to both understand his power, and to understand the history of his extinct kind. By both utilizing Ryu's unique power and the abilities of those whom assist him, players will uncover the history of the Brood, learn more about the characters, and the very reason why the Brood were wiped out.
Players control Ryu and his allies on their journey, each of Ryu's friends have abilities only they can use, and they will have to work together to make their way through the obstacles and enemies that they encounter; creativity is key to your success in this game!",Breath of Fire III
0,84,0,0,,0.0,2010-12-31,,0.0,0.0,0.0,https://images.igdb.com/igdb/image/upload/t_original/dh766uqqzxrlahlynqom.png,Nippon Ichi Software,PSP,https://images.igdb.com/igdb/image/upload/t_original/co2hhq.png,Nippon Ichi Software,,Backlog,"Cladun, short for ""Classic Dungeon"", is a retro-twinged sprite-based dungeon crawler for the PSP, developed by Nippon Ichi. Cladun features the ability to swap between regular and ""8-bit"" styles (both in graphics and music), and has ad hoc co-op multiplayer.",Cladun: This is an RPG
0,77,0,0,,0.0,2011-11-22,,0.0,0.0,0.0,https://images.igdb.com/igdb/image/upload/t_original/abcsh140zo0ncmsoxois.png,Team GrisGris,PSP,https://images.igdb.com/igdb/image/upload/t_original/co1s68.png,"Marvelous USA, Inc.",,Backlog,"A group of friends unknowingly perform an occult ritual that traps them in an otherworldly elementary school. Here, the vengeful spirits of young children threaten their lives and their sanity, and the only hope of survival is to uncover the chilling details behind the murders of those trapped before them...",Corpse Party
0,0,0,0,,0.0,2013-01-23,,0.0,0.0,0.0,https://images.igdb.com/igdb/image/upload/t_original/xnfdmnut6vep0m09a6ew.png,,PSP,https://images.igdb.com/igdb/image/upload/t_original/co2nie.png,,,Backlog,Corpse Party: Book of Shadows is a survival horror adventure game and the sequel to Corpse party BloodCovered: ...Repeated Fear. Corpse Party: Book of Shadows adds new twists and backgrounds for the characters who were barely touched upon in Corpse Party and mostly plays as a prequel.,Corpse Party: Book of Shadows
0,43,0,0,,0.0,2010-07-06,,0.0,0.0,0.0,https://images.igdb.com/igdb/image/upload/t_original/yqzs0cudelbln4bbu78z.png,"Vicious Cycle Software, Inc.",PSP,https://images.igdb.com/igdb/image/upload/t_original/co2nkf.png,D3Publisher,,Backlog,"Be Despicable! (It’s fun!) Despicable Me: The Game lets players of all ages experience the thrill of being Gru, one of the world’s greatest supervillains who is planning the biggest heist in history – stealing the moon. Complete heists and missions in a unique blend of action and puzzle solving that combines the fun of commanding minions and using an arsenal of Despicable gadgets and weapons.",Despicable Me: The Game
0,86,0,0,,0.0,2009-09-04,,0.0,0.0,0.0,https://images.igdb.com/igdb/image/upload/t_original/sc7haw.png,Square Enix,PSP,https://images.igdb.com/igdb/image/upload/t_original/co205i.png,Square Enix,,Backlog,"Dissidia Final Fantasy is a 3D-arena fighting game with RPG elements featuring 20 characters, heroes and villains, from the first 10 final fantasy games summed by the god of discord and the goddess of harmony to fight over the fate of the world.",Dissidia Final Fantasy
0,0,0,0,,0.0,2007-10-05,,0.0,0.0,0.0,https://images.igdb.com/igdb/image/upload/t_original/i7eclvoyizmfehlp4879.png,Square Enix,PSP,https://images.igdb.com/igdb/image/upload/t_original/co1pn8.png,Square Enix,,Backlog,"An updated version of the PlayStation game Final Fantasy Tactics, released on PlayStation Portable and later released on iOS and Android.

""The stage is set for what history would one day record as the War of the Lions.

Experience new CG cinematics. Meet new Characters. Explore new jobs & missions. Wage new multiplayer battles. Behold a new legend!""",Final Fantasy Tactics: The War of the Lions
0,0,0,0,,0.0,2011-10-27,,0.0,0.0,0.0,https://images.igdb.com/igdb/image/upload/t_original/scm61r.png,,PSP,https://images.igdb.com/igdb/image/upload/t_original/co2uk8.png,,,Backlog,"Final Fantasy Type-0 is set within Orience, a land divided between four nations or ""Crystal States"". Each nation has crystals of power based on the Four Symbols, which are in turn their national emblems. The Dominion of Rubrum uses the Vermillion Bird Crystal, which controls magic; the Milites Empire controls the White Tiger Crystal, containing the power of science and weapons; the Kingdom of Concordia uses the Azure Dragon Crystal, containing the power of Dragons; and the Lorican Alliance is home to the Black Tortoise Crystal, containing the power of shielding. Each nation has an academy, or Peristylium, to research and protect the country's respective crystal. The crystals have the ability to mark humans as their countries' servants. These servants, called l'Cie, are branded with a symbol and are given a ""Focus"", a task to complete. While blessed with long life and the ability to transform into crystal, l'Cie are cursed to lose their memories over time. The people of Orience also lose their memories of the dead, so they will not be held back by any past regrets and continue strengthening their souls through conflict, a mechanism put in place by the crystals for the convenience of the deities who crafted them. The main aim of many characters is to become Agito, a legendary figure who will appear and save the world from Tempus Finis, an apocalyptic event that will destroy Orience.",Final Fantasy Type-0
0,0,0,0,,0.0,2012-07-12,,0.0,0.0,0.0,https://images.igdb.com/igdb/image/upload/t_original/.png,Sting Entertainment,PSP,https://images.igdb.com/igdb/image/upload/t_original/co2hjd.png,Atlus,,Backlog,"In a land ravaged by disparity where the impoverished must battle for survival, the fate of all is thrust into uncertainty when rebels happen upon custody of a young female noble and a magical spear of immeasurable power falls from the heavens. Now, hunted by incumbent powers desperate to reclaim the girl and armed with a weapon capable of reshaping the realm, the Resistance must wage war to deliver themselves from the tyranny of their oppressors.
As original as its narrative, Gungnir's strategy RPG mechanics offer a number of fresh twists on an expertly honed formula. Building upon the traditional action queue of turn-based strategy RPGs, actions in Gungnir all have a numerical wait interval associated with them. Faster actions bear smaller numbers, allowing them to precede slower preexisting attacks. Should the player wish, they may sacrifice tactical points, which afford them more combat options, in order to accelerate actions. This classic balance of risk and reward, a staple of Sting titles, enriches the Gungnir's deep strategic battles and gives the player far more critical decisions to weigh.",Gungnir
0,0,0,0,,0.0,2007-02-13,,0.0,0.0,0.0,https://images.igdb.com/igdb/image/upload/t_original/agaabsmcnwap3spszjbs.png,,PSP,https://images.igdb.com/igdb/image/upload/t_original/co25gm.png,,,Backlog,"The PSP releases are a port of the original Japanese PC game with the rhythm bar removed. The 2015 release is a remasted version of the original PC game. The game had to be remade for the 3DS, 'Gurumin 3D: A Monstrous Adventure'. It is a port of the remastered version that has been changed to better fit the systems controls and use the 3D feature.

""Gurumin: A Monstrous Adventure is a fantastic Action-RPG from leading Japanese developer Falcom (Developers of “Ys” and “Zwei” among other classics) featuring real-time combat, stunning 3D graphics, tons of fully voiced characters and mini-games , 90+ items, multiple endings, a rocking soundtrack, 35+ hours of playtime, and more.

Originally released outside Japan on Sony’s PSP®, Mastiff is proud to bring a fully localized and updated version of Gurumin: A Monstrous Adventure to Windows and to offer it through Steam with a full set of Steam specific features including Achievements, Trading Cards, Big Picture and Cloud Save.""",Gurumin: A Monstrous Adventure
0,0,0,0,,0.0,2010-07-02,,0.0,0.0,0.0,https://images.igdb.com/igdb/image/upload/t_original/sc6spj.png,,PSP,https://images.igdb.com/igdb/image/upload/t_original/co2no6.png,,,Backlog,"Hexyz Force for PlayStation Portable is a traditional RPG taking place in the world of Berge. This world has two sides to it, one light and one dark. Accordingly, the player will be able to choose between two different protagonists at the game's beginning. In the light scenario, the protagonist is a shrine maiden by the name of Cecilia, whereas the dark part's hero is a knight called Leevan. Depending on this choice, the setting, story and characters will change fundamentally.",Hexyz Force
0,0,0,0,,0.0,2007-06-18,,0.0,0.0,0.0,https://images.igdb.com/igdb/image/upload/t_original/scmiw9.png,Marvelous,PSP,https://images.igdb.com/igdb/image/upload/t_original/co26oy.png,Natsume,,Backlog,"Life is good for the residents of Heartflame Island, especially since new robots and automated machines do almost all of the work. But technology is a tool--not an answer to all problems. Maybe that's why everyone is a little uneasy about the old stories of strange magic and a prediction that Flame Mountain will erupt and destroy everything. That's why Dr. Hope, a caring and wise old scholar has sent you, his son on a journey to the ancient ruins to try and run a farm. It is your father's dream that you will unlock the secrets of the ancient ruins and find the meaning of ""life"".",Innocent Life: A Futuristic Harvest Moon
0,77,0,0,,0.0,2009-11-20,,0.0,0.0,0.0,https://images.igdb.com/igdb/image/upload/t_original/f72qpzjxbwo06by0ndh0.png,High Impact Games,PSP,https://images.igdb.com/igdb/image/upload/t_original/co2agh.png,Sony Computer Entertainment,,Backlog,"When their world begins to run out of Eco, Jak and Keira travel to the edge of the world in search of the ancient Precursor machinery that could reverse the planet's decline. They're not the only interested factions out on the Brink, however; Jak must contend with Sky Pirates while struggling to control his own Eco powers.",Jak and Daxter: The Lost Frontier
0,76,0,0,,0.0,2007-08-21,,0.0,0.0,0.0,https://images.igdb.com/igdb/image/upload/t_original/hq8vhdgqv6fodwohx89n.png,LEVEL-5,PSP,https://images.igdb.com/igdb/image/upload/t_original/co1pnd.png,Sony Computer Entertainment,,Backlog,"Jeanne d'Arc is a tactical role-playing video game loosely based on the story of Joan of Arc and her struggles against the English occupation of France during the Hundred Years' War in the early 15th century.

The game has an amount of historical accuracy when it comes to the cast of characters, and contains many who were contemporaries and allies of Joan of Arc. This contrasts starkly with the many fantasy elements of the game, such as characters possessing magical armlets that give the wearer special abilities, and the suggestion that King Henry VI of England was possessed by demons and used them to aid his armies in destroying France during the Hundred Years' War.",Jeanne d'Arc
0,0,0,0,,0.0,2011-04-22,,0.0,0.0,0.0,https://images.igdb.com/igdb/image/upload/t_original/.png,,PSP,https://images.igdb.com/igdb/image/upload/t_original/co2noa.png,,,Backlog,"In Jikandia, you must travel through dungeons in search of your friends. You can set the time limit for each dungeon yourself! Dungeons are altered in several ways according to the time limit you set, so no adventure is the same twice!",Jikandia: The Timeless Land
0,0,0,0,,0.0,2011-01-20,,0.0,0.0,0.0,https://images.igdb.com/igdb/image/upload/t_original/sc8e6z.png,,PSP,https://images.igdb.com/igdb/image/upload/t_original/co3166.png,,,Backlog,"The Final Mix gives you more challenges and the chance to hear the English voices. The game is based on the upgraded US version, with more boss battles, game modes and even more mini-games. Think you've already become the ultimate Key Blade Master? Think again.

The game contains secret episodes that you can unlock, and in the single player mode, you'll meet the mysterious man, see what secrets he'll reveal about the powerful Kingdom Hearts. Controls and the D-Link are updated, so its easier to use and you can collect stickers on your journey.

There are 9 more missions for you to clear and new challenging bosses in the multi-mode. These bosses aren't just the lord of the world, they could be the world themselves. Now you can battle the whale that swallowed Pinocchio's ship.

Kingdom Hearts is being born again, pick up your key blade and set off on your journey once again.",Kingdom Hearts Birth by Sleep Final Mix
0,0,0,0,,0.0,2010-07-15,,0.0,0.0,0.0,https://images.igdb.com/igdb/image/upload/t_original/scgpr0.png,,PSP,https://images.igdb.com/igdb/image/upload/t_original/co2npp.png,,,Backlog,"Last Ranker is a Role-Playing game, developed by Image Epoch and published by Capcom, which was released in Japan in 2010.This game's main objective is to raise up your ranker level to the top until
you became the Last Ranker as title said.You raised your ranks by doing
quests and battling/dueling other rankers. So you may find,that most of your
time is used up to doing quests and dueling other rankers.",Last Ranker
0,0,0,0,,0.0,2010-04-02,,0.0,0.0,0.0,https://images.igdb.com/igdb/image/upload/t_original/sc9e0n.png,,PSP,https://images.igdb.com/igdb/image/upload/t_original/co1pnn.png,,,Backlog,"While seemingly placid on the surface, the world of Lunar is slowly descending into chaos, as the Goddess Althena, the creator and guardian of the world, has disappeared and the valiant efforts of the legendary Dragonmaster Dyne and his faithful companions fade into obscurity. With Althena gone and no one able or willing to become the next Dragonmaster, a shadowy figure, known only as the Magic Emperor, has started plotting to usurp Althena's place and become a god. In a remote village far removed from the decay that is slowly spreading throughout the world lives a young man named Alex, who dreams of one day becoming the next Dragonmaster like his hero Dyne. One day, Alex's friend Ramus convinces him to head towards a cave near town, where it is rumored the legendary White Dragon resides. With Alex's adopted sister Luna and his mysterious pet Nall in tow, Alex heads off on what seems to be a meaningless adventure, not knowing that it would be the first step in an epic journey with the fate of the entire world at stake.",Lunar: Silver Star Harmony
0,0,0,0,,0.0,2009-03-27,,0.0,0.0,0.0,https://images.igdb.com/igdb/image/upload/t_original/sclqzw.png,Gust,PSP,https://images.igdb.com/igdb/image/upload/t_original/sxju2tfbfq6zkxz0emeo.png,Gust,,Backlog,"The 4th entry in the RPG series, Mana Khemia is different from the previous Atelier Iris games. Mana Khemia is a campus sim style RPG, where you can interact with classmates and professors to complete academic quests. You play as Vayne Aurelius, a novice alchemist who was invited to attend Al - Revis Academy. At the academy, Vayne will meet human and not so human alchemists, and together you will solve the mysteries of alchemy.",Mana Khemia: Student Alliance
0,38,0,0,,0.0,2012-12-20,,0.0,0.0,0.0,https://images.igdb.com/igdb/image/upload/t_original/txqplfhjwa4byiikgjjh.png,Three Rings Inc.,PSP,https://images.igdb.com/igdb/image/upload/t_original/co6o3g.png,Bandai Namco Entertainment,,Backlog,"The game is an RPG; it uses turn-based battles and action commands that help guide the player. The player commands the protagonist Luffy and other characters that are in his crew. The characters level up, and the player can strengthen attacks by obtaining points. All characters and enemies are from the One Piece series and play the same roles as seen in the source material. Cutscenes are told in a manga style.",One Piece: Romance Dawn
0,80,0,0,,0.0,2006-10-20,,0.0,0.0,0.0,https://images.igdb.com/igdb/image/upload/t_original/youhop5o4jqtculr2pbq.png,,PSP,https://images.igdb.com/igdb/image/upload/t_original/co3gtn.png,Capcom,,Backlog,"Capcom ported the entire Power Stone series to the PlayStation Portable with a few enhancements: most notably, the PSP version of the original Power Stone included the four new characters introduced in Power Stone 2.",Power Stone Collection
0,0,0,0,,0.0,2009-06-26,,0.0,0.0,0.0,https://images.igdb.com/igdb/image/upload/t_original/sc9nce.png,,PSP,https://images.igdb.com/igdb/image/upload/t_original/co2h51.png,,,Backlog,"Prinny will be the most heart-pounding and challenging side-scrolling action game ever. Players will control an unlucky penguin dude called a Prinny and slash their way through various Netherworlds. For this tough-as-nails action game, you're given 1000 units to accomplish your mission, but even with those 1000 units you will have to use everything you find on the battlefield to survive. Lift and throw objects, stomp enemies, even pilot tanks and planes to bombard whatever gets in your way!",Prinny: Can I Really Be the Hero?
0,0,0,0,,0.0,2010-12-15,,0.0,0.0,0.0,https://images.igdb.com/igdb/image/upload/t_original/sc9ncf.png,,PSP,https://images.igdb.com/igdb/image/upload/t_original/co2h50.png,,,Backlog,"Prinny 2 is a side scrolling hack and slash action game. Players will control demonic penguins, Prinnies, who are known as the ""weakest monsters in the Netherworld."" Players can run, jump, slash, execute special skills, and ride tanks or jets to battle enemies. The Prinnies' mission is to find Demon Lord Etna's stolen panties! If they fail... Etna will turn THEM into panties! As an extra bonus, a whole new main character and story become available after you complete the main game.","Prinny 2: Dawn of Operation Panties, Dood!"
0,60,0,0,,0.0,2007-05-11,,0.0,0.0,0.0,https://images.igdb.com/igdb/image/upload/t_original/xa75e22nyfzudtzxeqna.png,High Impact Games,PSP,https://images.igdb.com/igdb/image/upload/t_original/co230r.png,Sony Computer Entertainment,,Backlog,"Ratchet & Clank: Size Matters (known as Ratchet & Clank 5 in Japan) is a 2007 platformer video game developed by High Impact Games and published by Sony Computer Entertainment for the PlayStation Portable and PlayStation 2. The game is the first Ratchet & Clank title on the PSP handheld. Development company High Impact Games was spawned from the original Ratchet & Clank developer, Insomniac Games. The story is about Ratchet and Clank as they are interrupted from their vacation to search for a kidnapped girl and encounter a forgotten race known as the Technomites",Ratchet & Clank: Size Matters
0,81,0,0,,0.0,2008-06-17,,0.0,0.0,0.0,https://images.igdb.com/igdb/image/upload/t_original/sc5rpl.png,Sanzaru Games,PSP,https://images.igdb.com/igdb/image/upload/t_original/co2iwb.png,Sony Computer Entertainment,,Backlog,"After being side-kick to Ratchet for so long, Clank takes matters into his own hands to save Ratchet and solve the crime of the century.",Secret Agent Clank
0,0,0,0,,0.0,2012-10-04,,0.0,0.0,0.0,https://images.igdb.com/igdb/image/upload/t_original/sc94yg.png,Imageepoch,PSP,https://images.igdb.com/igdb/image/upload/t_original/co2otd.png,Imageepoch,,Backlog,"Sol Trigger is the La Résistance to the Machine Church which rules the dystopian city of Kaiserhald. The Machine Church is using a miraculous energy source known as ""Sol"" to raise the city to even greater heights, but Sol Trigger know that Sol is secretly made from people, and that the Church intends to ramp up their production with a new form of twisted technology.",Sol Trigger
0,0,0,0,,0.0,2005-10-22,,0.0,0.0,0.0,https://images.igdb.com/igdb/image/upload/t_original/.png,,PSP,https://images.igdb.com/igdb/image/upload/t_original/co2nyf.png,,,Backlog,"A vicious circle of violence has erupted. The battle torn continent of Neverland is caught up in a great war between good and evil once again. Now, three young soldiers rise to put an end to this madness once and for all. In Spectral Souls, the player will switch between the three opposing kingdoms to play the Royal Demon Kingdom, the Imperial Army, or the Rebel Army. Depending on how you progress through the game with each of the forces, the story of the game will change.",Spectral Souls: Resurrection of the Ethereal Empires
